


<!DOCTYPE html PUBLIC "-//W3C//DTD XHTML 1.0 Strict//EN" "http://www.w3.org/TR/xhtml1/DTD/xhtml1-strict.dtd"> 

<html xmlns:v="urn:schemas-microsoft-com:vml" xmlns:o="urn:schemas-microsoft-com:office:office" xmlns="http://www.w3.org/1999/xhtml" >
<head><script src="../../Core/Common/libs/jquery/jquery-1.4.2.min.js" type="text/javascript"></script>
<script src="../../Core/Common/libs/jqueryUI/1.8/minified/jquery.core.core.min.js" type="text/javascript"></script>
<link href="../../Core/Common/libs/jqueryUI/1.8/themes/base/jquery.ui.core.css" rel="stylesheet" type="text/css" />
<link href="../../Core/Common/libs/jqueryUI/1.8/themes/tenrox/jquery.ui.core.css" rel="stylesheet" type="text/css" />
<link href="../../Core/Common/libs/jqueryUI/1.8/themes/base/jquery.ui.theme.css" rel="stylesheet" type="text/css" />
<link href="../../Core/Common/libs/jqueryUI/1.8/themes/tenrox/jquery.ui.theme.css" rel="stylesheet" type="text/css" />
<script src="../../Core/Common/libs/jqueryUI/1.8/minified/jquery.core.Widget.min.js" type="text/javascript"></script>
<script src="../../Core/Common/libs/jqueryUI/1.8/minified/jquery.core.Mouse.min.js" type="text/javascript"></script>
<script src="../../Core/Common/libs/jqueryUI/1.8/jquery.ui.Position.js" type="text/javascript"></script>
<script src="../../Core/Common/libs/jqueryUI/1.8/minified/jquery.Interactions.Draggable.min.js" type="text/javascript"></script>
<script src="../../Core/Common/libs/jqueryUI/1.8/minified/jquery.Interactions.Resizable.min.js" type="text/javascript"></script>
<link href="../../Core/Common/libs/jqueryUI/1.8/themes/base/jquery.ui.resizable.css" rel="stylesheet" type="text/css" />
<script src="../../Core/Common/libs/jqueryUI/1.8/minified/jquery.Widgets.Button.min.js" type="text/javascript"></script>
<link href="../../Core/Common/libs/jqueryUI/1.8/themes/base/jquery.ui.button.css" rel="stylesheet" type="text/css" />
<script src="../../Core/Common/libs/jqueryUI/1.8/jquery.ui.Dialog.js" type="text/javascript"></script>
<link href="../../Core/Common/libs/jqueryUI/1.8/themes/base/jquery.ui.dialog.css" rel="stylesheet" type="text/css" />
<link href="../../Core/Common/libs/jqueryUI/1.8/themes/tenrox/jquery.ui.dialog.css" rel="stylesheet" type="text/css" />
<script src="../../Core/Common/libs/jqueryUI/1.8/jquery.ui.datepicker.js" type="text/javascript"></script>
<link href="../../Core/Common/libs/jqueryUI/1.8/themes/base/jquery.ui.datepicker.css" rel="stylesheet" type="text/css" />
<link href="../../Core/Common/libs/jqueryUI/1.8/themes/tenrox/jquery.ui.datepicker.css" rel="stylesheet" type="text/css" />
<script src="../../Core/Common/json2-min.js" type="text/javascript"></script>
<link href="../../Core/Common/BasePage.css" rel="stylesheet" type="text/css" />
<script src="../../Core/Common/BasePage.js" type="text/javascript"></script>
<script src="../../Core/Common/jqueryPlugins/jquery.framejQuery.js" type="text/javascript"></script>
<script src="../../Core/Common/jqueryPlugins/jquery.nodeName.js" type="text/javascript"></script>
<script src="../../Core/Common/jqueryPlugins/jquery.eventstack.js" type="text/javascript"></script>
<script src="../../Core/Common/jqueryPlugins/jquery.bindOne.js" type="text/javascript"></script>
<script src="../../Core/Common/jqueryPlugins/jquery.getActiveElement.js" type="text/javascript"></script>
<script src="../../Core/Common/jqueryPlugins/jquery.disableEnable.js" type="text/javascript"></script>
<script src="../../Core/Common/jqueryPlugins/jquery.tableManipulations.js" type="text/javascript"></script>
<script src="../../Core/Common/jqueryPlugins/jquery.val.js" type="text/javascript"></script>
<script src="../../Core/Common/jqueryPlugins/jquery.cloneDeep.js" type="text/javascript"></script>
<script src="../../Core/Common/jqueryPlugins/jquery.preLoadImages.js" type="text/javascript"></script>
<script src="../../Core/Common/jqueryPlugins/messageBox/jquery.messageBox.js" type="text/javascript"></script>
<script src="../../Core/Common/TMessageBox.js" type="text/javascript"></script>
<script src="../../Core/Common/jqueryPlugins/bgiframe_2.1.2/jquery.bgiframe.js" type="text/javascript"></script>
<script src="../../Core/Common/jqueryPlugins/jquery.ba-dotimeout.min.js" type="text/javascript"></script>
<script src="../../Core/Common/jqueryPlugins/jquery.numeric.js" type="text/javascript"></script>
<script src="../../Core/Common/DateTimeHelpers.js" type="text/javascript"></script>
<script src="../../Core/Common/jqueryPlugins/jquery.TDatepicker.js" type="text/javascript"></script>
<script src="../../Core/Common/md5.js" type="text/javascript"></script>
<script src="../../Core/Common/Common1.js" type="text/javascript"></script>
<link href="../../Core/Common/styles/tWindowStyles.css" rel="stylesheet" type="text/css" />
<script src="../../Core/Common/navigation/pageLoading.js" type="text/javascript"></script>
<script src="../../Core/Common/navigation/tenroxWindow.js" type="text/javascript"></script>
<script src="../../Core/Common/navigation/pagePath.js" type="text/javascript"></script>
<script src="../../Core/Common/jqueryPlugins/jquery.enableDisablePage.js" type="text/javascript"></script>
<script src="../../Core/Common/Common95.js" type="text/javascript"></script>
<link href="../../Core/Common/Styles/utils.css" rel="stylesheet" type="text/css" />
<link href="../../Core/Common/Styles/TPageStyles.css" rel="stylesheet" type="text/css" />
<script src="../../Core/Common/tagging1.js" type="text/javascript"></script>
<title>
	 Hazleton, Stephen
</title>
   
   <!--to run report and Open Documents page  runreport( repUID, arr); -->
   <script type="text/javascript" language="javascript" src="../../Core/Common/Common2.js"></script>
   <script type="text/javascript" language="javascript">
     //NEEDED FOR THE FILE TSERVICE1.JS
     var astrService = new Array();
   </script>
   
   
   <script type="text/javascript" language="javascript1.2" src="../../Core/Common/md5.js"></script>
   <script type="text/javascript" language="javascript1.2" src="../../Core/Common/jencodedecode.js"></script>
   <script type="text/javascript" language="javascript1.2" src="../../Core/Common/TSalt.js"></script>
   <script type="text/javascript" language="javascript1.2" src="../../Core/Common/TService2.js"></script>
   <script type="text/javascript" language="javascript" src="../../Core/Common/TService1.js"></script>   
<!-- XXXXXXXXXXXXXXXXXXXXXXXXXXXXXXXXXXXXXXXXXXXXXXXXXXXXXXXXXXXXXXXXXXXXXXXXXXXXXXXXXXXXXXXXXXXXXXXXXXXXXXXXXXXXXXXXXXXXXXXXXXXXXXXXXXXXXXX-->    
    <link type="text/css" rel="StyleSheet" href="../../Core/Common/TProgressBar/TProgressBar.css" />
    <script type="text/javascript" language="javascript" src="../../Core/Common/TProgressBar/TProgressBar.js"></script>
<!-- XXXXXXXXXXXXXXXXXXXXXXXXXXXXXXXXXXXXXXXXXXXXXXXXXXXXXXXXXXXXXXXXXXXXXXXXXXXXXXXXXXXXXXXXXXXXXXXXXXXXXXXXXXXXXXXXXXXXXXXXXXXXXXXXXXXXXXX-->
    <script type="text/javascript" language="javascript" src="../../Core/Common/JSBalloon.js"></script>
    <script type="text/javascript" language="javascript" src="../../Core/Common/JSNoteBallon.js"></script>
    <link href="../../Core/Common/JSBalloon.css" type="text/css" rel="stylesheet" /> 
<!-- XXXXXXXXXXXXXXXXXXXXXXXXXXXXXXXXXXXXXXXXXXXXXXXXXXXXXXXXXXXXXXXXXXXXXXXXXXXXXXXXXXXXXXXXXXXXXXXXXXXXXXXXXXXXXXXXXXXXXXXXXXXXXXXXXXXXXXX-->
    <script type="text/javascript" language="javascript" src="../../Core/Common/TBrowserType.js"></script>
    <script type="text/javascript" language="javascript" src="../../Core/Common/TEvent.js"></script>
    <script type="text/javascript" language="javascript" src="../../Core/Common/TDate.js"></script>
<!-- XXXXXXXXXXXXXXXXXXXXXXXXXXXXXXXXXXXXXXXXXXXXXXXXXXXXXXXXXXXXXXXXXXXXXXXXXXXXXXXXXXXXXXXXXXXXXXXXXXXXXXXXXXXXXXXXXXXXXXXXXXXXXXXXXXXXXXX-->
    <link href="../../Core/Common/TInputControl/TInputControl.css" type="text/css" rel="stylesheet" />    
    <script type="text/javascript" language="javascript" src="../../Core/Common/TInputControl/TInputControl.js"></script>
<!-- XXXXXXXXXXXXXXXXXXXXXXXXXXXXXXXXXXXXXXXXXXXXXXXXXXXXXXXXXXXXXXXXXXXXXXXXXXXXXXXXXXXXXXXXXXXXXXXXXXXXXXXXXXXXXXXXXXXXXXXXXXXXXXXXXXXXXXX-->
    <link href="../../Core/Common/TGrid/TGrid.css" type="text/css" rel="stylesheet" />
    <script type="text/javascript" language="javascript" src="../../Core/Common/TGrid/TGrid.js"></script>
    <script type="text/javascript" language="javascript" src="../../Core/Common/TGrid/TCollection.js"></script>
    <script type="text/javascript" language="javascript" src="../../Core/Common/TGrid/TScroll.js"></script>
    <script type="text/javascript" language="javascript" src="../../Core/Common/TGrid/TResize.js"></script>
    <script type="text/javascript" language="javascript" src="../../Core/Common/TGrid/TColumn.js"></script>
<!-- XXXXXXXXXXXXXXXXXXXXXXXXXXXXXXXXXXXXXXXXXXXXXXXXXXXXXXXXXXXXXXXXXXXXXXXXXXXXXXXXXXXXXXXXXXXXXXXXXXXXXXXXXXXXXXXXXXXXXXXXXXXXXXXXXXXXXXX-->
    <link rel="stylesheet" href="../../Core/Common/TContextMenu/TContextMenu.css" />
    <script type="text/javascript" language="javascript" src="../../Core/Common/TContextMenu/TContextMenu.js" ></script>
<!-- XXXXXXXXXXXXXXXXXXXXXXXXXXXXXXXXXXXXXXXXXXXXXXXXXXXXXXXXXXXXXXXXXXXXXXXXXXXXXXXXXXXXXXXXXXXXXXXXXXXXXXXXXXXXXXXXXXXXXXXXXXXXXXXXXXXXXXX-->
    <link href="TimeTemplate.css" type="text/css" rel="stylesheet" />
    <script type="text/javascript" language="javascript" src="TimeTemplateAllSections.js"></script>
    <script type="text/javascript" language="javascript" src="TimeTemplate.js"></script>
    <script type="text/javascript" language="javascript" src="TimeTemplateInputshadow.js"></script>
    <script type="text/javascript" language="javascript" src="TimeTemplateContextMenu.js" ></script>
    <script type="text/javascript" language="javascript" src="TimeTemplateHelper.js" ></script>
    <script type="text/javascript" language="javascript" src="TimeTemplateSpecialRow.js" ></script>
    <script type="text/javascript" language="javascript" src="TimeTemplateProcessRules.js" ></script>
    <script type="text/javascript" language="javascript" src="TimeTemplateRules.js" ></script>
    <script type="text/javascript" language="javascript" src="TimeTemplateKeyDown.js" ></script>
    <script type="text/javascript" language="javascript" src="TimeTemplateTAjax.js" ></script>
    <script type="text/javascript" language="javascript" src="TimeTemplateAttendance.js" ></script>
    <script type="text/javascript" language="javascript" src="TimeTemplate_CUSTOMIZATION_GOES_HERE.js" ></script>
    <script type="text/javascript" language="javascript" src="TimeSheetToolTip.js"></script>
    
<!-- XXXXXXXXXXXXXXXXXXXXXXXXXXXXXXXXXXXXXXXXXXXXXXXXXXXXXXXXXXXXXXXXXXXXXXXXXXXXXXXXXXXXXXXXXXXXXXXXXXXXXXXXXXXXXXXXXXXXXXXXXXXXXXXXXXXXXXX-->
<!-- XXXXXXXXXXXXXXXXXXXXXXXXXXXXXXXXXXXXXXXXXXXXXXXXXXXXXXXXXXXXXXXXXXXXXXXXXXXXXXXXXXXXXXXXXXXXXXXXXXXXXXXXXXXXXXXXXXXXXXXXXXXXXXXXXXXXXXX-->
<!-- XXXXXXXXXXXXXXXXXXXXXXXXXXXXXXXXXXXXXXXXXXXXXXXXXXXXXXXXXXXXXXXXXXXXXXXXXXXXXXXXXXXXXXXXXXXXXXXXXXXXXXXXXXXXXXXXXXXXXXXXXXXXXXXXXXXXXXX-->
<!--[if IE]>

    <script type="text/javascript" event="onmouseover" for="TBX">
       onmouseoverTextBox(this);
    </script>
    <script type="text/javascript" event="onmouseout" for="TBX">
       ononmouseoutTextBox(this);
    </script>
        
    <script type="text/javascript" event="onfocus" for="TBX">
       oncellfocusClick(this);
    </script>
    <script type="text/javascript" event="onclick" for="TBX">
       oncellfocusClick(this);
    </script>
    <script type="text/javascript" event="oncontextmenu" for="TBX">
      try
      {
        oncellfocusClick(this);
        var oTEvent = new TEvent(event);
        oTEvent.srcElement(oTInputControl);
        onContextMenu_oTInputControl(oTEvent);
      }
      catch(e){}
    </script>
    
    <script type="text/javascript" event="onfocus" for="DOTS">
       //onDotsFocusClick(this);
    </script>
    <script type="text/javascript" event="onclick" for="DOTS">
       //onDotsFocusClick(this);
    </script>
    
    <script type="text/javascript" event="onclick" for="IMGCTRLS">
      try
      {
        return oTTimesheet.onImgCtrlsClick(this);
      }catch(e){}
    </script>
    <script  type="text/javascript" event="onkeydown" for="IMGCTRLS">
      try
      {
        return onkeydown_oImg(event);
      }catch(e){}
    </script>

    <script type="text/javascript" event="oncontextmenu" for="TSLT">
       onContextMenu_TimeSheetLeftContainer(this);
    </script>
    <script type="text/javascript" event="oncontextmenu" for="TSLTNON">
       onContextMenu_TimeSheetLeftContainer(this);
    </script>
    <script type="text/javascript" event="onfocus" for="TSLT">
       //onDotsFocusClick(this);
    </script>
    <script  type="text/javascript" event="onkeydown" for="TSLT">
      return onkeydown_oA(event);
    </script>
    <script  type="text/javascript" event="onkeydown" for="TSLTNON">
      return onkeydown_oA(event);
    </script>
    <script  type="text/javascript" event="onmouseover" for="TSLT">
      this.title=this.innerText;
      onmouseoverAss(this);
    </script>
    <script  type="text/javascript" event="onmouseout" for="TSLT">
      onmouseoutAss(this);
    </script>
    <script  type="text/javascript" event="onmouseover" for="TSLTNON">
      this.title=this.innerText;
    </script>
    <![endif]-->
<!-- XXXXXXXXXXXXXXXXXXXXXXXXXXXXXXXXXXXXXXXXXXXXXXXXXXXXXXXXXXXXXXXXXXXXXXXXXXXXXXXXXXXXXXXXXXXXXXXXXXXXXXXXXXXXXXXXXXXXXXXXXXXXXXXXXXXXXXX-->
<link id="TIntervalcss" type="text/css" rel="stylesheet" href="../../Core/Common/TInterval.css" /><link type="text/css" rel="stylesheet" href="/TEnterprise/RadControls/Input/Skins/Tenrox/styles.css" /><link type="text/css" rel="stylesheet" href="/TEnterprise/RadControls/ComboBox/Skins/Tenrox/Styles.css" /><link type="text/css" rel="stylesheet" href="/TEnterprise/WebResource.axd?d=W9-8bWjaeX5jMQB3XblLP3N5e8ExtfCl4fDmLOik8fx_zFj90Ey07KypcOc2RaFXtrh_NNhUxcSLs-WRgljGuUCMRUwIHHGmZbpeo-nK4Xl_RbwZJUU8yJz4PRbASIVcSWuOY9ZfUaoTz3hd-896r84BYVO9CPApKNYC7pT3APP5sB-7kHFjM1eZr3p1AE_g0&amp;amp;t=634498881360000000" /><link type="text/css" rel="stylesheet" href="/TEnterprise/WebResource.axd?d=1g0fNVJ6yWBjbaa-2H0Z2_aNR-UWoIkeEQjBou8SpX8fmrYdypQqGcGnVSjExEQZQnPYJ9WWxoZb_Mcmv48Z9XizYCsJj9te6YjhpL2yv50d-wN-IhDt9BGOMshz-IFqy1SXod_ReDNHDIhYTa5Bklq4Xk2W-8bCUuTLNkTnsHVpw_uShAgagWA4_z3xmFs90&amp;amp;t=634498881360000000" /><link type="text/css" rel="stylesheet" href="/TEnterprise/WebResource.axd?d=ZEkbUZtsp18qXYcuzoYSUNU11D-blbf01WmXT7djQ-gp6hrOfQoUL9Rc4YMDcOXRg4iEMo2FJlDlyTm_iV2YFBJx816GUHqNbCroMYANlz0LuK8uwjBY9xW268SxKbzGw9u8Aljw33H5v8q7G6GbsCkaBwZ_Nj1fZsja9GVMPyQQ9WZphxXfSAeBYpgQk_-K0&amp;amp;t=634498881360000000" /></head>
   <body style="OVERFLOW:visible;" class="TScrollbar" onload="TimesheetSectionOnload('TSControl1');">
      <form name="frmTimeTamplate" method="post" action="TimeTemplate.aspx?UserUId=367&amp;SD=03%2f24%2f2013&amp;ROBJT=26&amp;r=0.3009296082891524&amp;pageKey=a75440cc15c458200248c44ec0c24fd7" id="frmTimeTamplate">
<div>
<input type="hidden" name="E_IsDataChanged" id="E_IsDataChanged" value="" />
<input type="hidden" name="__VIEWSTATE" id="__VIEWSTATE" value="/wEPDwUKMTczODg4MDcyMWQYDQUeX19Db250cm9sc1JlcXVpcmVQb3N0QmFja0tleV9fFgwFD1ByZXZpZXdDb21ib2JveAUSTk9OV09SS0lOR1RBU0tfYWRqBQ5OT05XT1JLSU5HVEFTSwULUFJPSkVDVF9hZGoFB1BST0pFQ1QFC1BST0pFQ1RfZHVwBQhUQVNLX2FkagUEVEFTSwUIVEFTS19kdXAFCkNIQVJHRV9hZGoFBkNIQVJHRQUKQ0hBUkdFX2R1cAUIVEFTS19kdXAPFCsAAmVlZAULUFJPSkVDVF9kdXAPFCsAAmVlZAUIVEFTS19hZGoPFCsAAmVlZAUKQ0hBUkdFX2Fkag8UKwACZWVkBQpDSEFSR0VfZHVwDxQrAAJlZWQFD1ByZXZpZXdDb21ib2JveA8UKwACBSRTdW1tYXJpemVkIFBlcnNvbmFsIFRpbWVzaGVldCBSZXBvcnQFAzY0MmQFDk5PTldPUktJTkdUQVNLDxQrAAJlZWQFBkNIQVJHRQ8UKwACZWVkBQRUQVNLDxQrAAJlZWQFB1BST0pFQ1QPFCsAAmVlZAULUFJPSkVDVF9hZGoPFCsAAmVlZAUSTk9OV09SS0lOR1RBU0tfYWRqDxQrAAJlZWSkSR9rCk0kM/rVDWTIGbcbRJKd1sl+msZ2ghr7Ql/WqA==" />
</div>


<script src="../../Core/Common/TXmlDocumentReader.js" type="text/javascript"></script>
<script src="../../Core/Common/TAjax.js" type="text/javascript"></script>
<script type="text/javascript">
//<![CDATA[
var glb_basePageInit = 1;var basePage = new BasePage();glb_basePageInit = 0;basePage.OrgName = 'OpenBet';basePage.AppPath = '/TEnterprise/';var lPathName = '/TEnterprise/';basePage.DisableDirtyFlag = 1;basePage.DatabasePath = 'OpenBet';basePage.ErrorMethod = 0;basePage.SessionTimeout = 1170000;basePage.CurrentUserId = 367;basePage.CurrentUserName = 'SHAZLETO';basePage.CurrentCulture.LanguageId = 0;basePage.CurrentCulture.DecimalSeparator = '.';basePage.CurrentCulture.ThousandSeparator = ',';basePage.CurrentCulture.DateSeperator = '/';basePage.CurrentCulture.DateFormat = 'dd/MM/yyyy';basePage.CurrentCulture.DecimalDigits = 2;basePage.IsDialog = false;basePage.IsTabContainerPage = false;basePage.HashTAjax = 0;basePage.HashTWCF = 0;basePage.HandleClientSideError = false;basePage.BuildNumber = '6944';basePage.ReleaseNumber = '12.00.00';basePage.BuildDate = '09-06-2011';basePage.VpmGuid = 'db2ec64e-c252-4ac6-933f-5d2800e8b5aa';basePage.SetRemoveSessionsList('');basePage.GlbTexts[0] = "Do you want to discard the changes?";basePage.GlbTexts[1] = "Some of the required fields are missing.";basePage.GlbTexts[2] = "Your connection has timed-out or the server has been reset.";basePage.GlbTexts[3] = "Tag It...";basePage.Resource.Selected = "Selected";basePage.Glb_Hardpath = 'C:\\Websites\\OpenBet\\WEB';var Glb_DocType = '1';var Glb_QAMode = '0';var Glb_DebugMode2 = '0';var Glb_DisplayPagesInDialogs = '0';var Glb_DisplayChildPagesInDialogs = '0';var Glb_EncryptTService = '0';var Glb_HashTService = '0';GlbTaggingEnabled=false;GlbTaggingDisplayTagLink = false;GlbHasTaggingLicense = 0;basePage.AttachOnLoadEvents();try{window.onerror = HandlePageError;}catch(e){}var Glb_PageTimeoutMiliSec = 2000;var GlbIsOnLoadPageCalled = 0;var Glb_PageTimeoutObj = null;basePage.txtCtrlXML = 'txtCtrlXML';basePage.Resource.TimeDetails ="Details";basePage.Resource.TitleDetails ="Time Entry Details";basePage.Resource.AssDetails ="Assignment Details";basePage.Resource.Client ="Client";basePage.Resource.Project ="Project";basePage.Resource.ProjectManager ="Project Manager";basePage.Resource.Task ="Task";basePage.Resource.StartDate ="Start Date";basePage.Resource.ETC ="ETC";basePage.Resource.EndDate ="End Date";basePage.Resource.PercentComplete ="% Complete";basePage.Resource.BtnNew ="New";basePage.Resource.btnClose ="Close";basePage.Resource.openEnded ="Open ended";basePage.Resource.ALERT ="Alert";basePage.Resource.INVOICE ="Invoice";basePage.Resource.NOTICE ="Notice";basePage.Resource.RD ="R&D";basePage.Resource.SPECS ="Specifications";basePage.Resource.STATUS ="Status";basePage.Resource.perErr ="Cannot move to a period before user's hire date or after user's termination date.";basePage.Resource.TOF ="Timesheet of";basePage.Resource.ArchiveMsg ="This action will archive the Timesheet(s). Once a Timesheet is archived, it can no longer be modified. Are you sure you want to continue?";basePage.Resource.rejNoteTitle ="Rejection Note";basePage.Resource.SourceState ="Source State";basePage.Resource.DestinationState ="Destination State";basePage.Resource.DateModified ="Date Modified";basePage.Resource.ModifiedBy ="Modified By";basePage.Resource.Action ="Action";basePage.Resource.Description ="Description";basePage.Resource.QuesDiscardChanges ="Do you want to discard the changes?";basePage.Resource.secAdjustments ="Adjustments";basePage.Resource.SucUpdated ="The Timesheet has been successfully updated.";basePage.Resource.InOutString ="IN&lt;br&gt;OUT";basePage.Resource.InOutNoteString ="In/Out Entry:";basePage.Resource.tsApprovalStatus ="Timesheet Approval Status";//]]>
</script>

<script src="/TEnterprise/WebResource.axd?d=EFXdgFOxvGHI3ll56kS3pghAYym1rz0b-PsIClBkQukS9BqC3tvJEXjTYmWFxq3UjuRgmWMnHKCxeokdixHhx_mf7GvIwEBra4b0O4c6CPM0GDf2b1YzfumjxacCe0E3OUhXD954OaGrmZQRqCF6lE3kaaXwGaikK4wbH-KfbwwKKx_E5XGIBhPy7IZXWoY7b1W6KqDm_frsxuy0wmF7QQ2&amp;t=634556680204710022" type="text/javascript"></script>
<script src="/TEnterprise/WebResource.axd?d=GiQQDHMpHxEDJMuauFIkN0ds_918hZEH4jumIh8FtanyxDTehsrhvUI779yJfeNwYhdXns8XYNp2ZjJwWqWIy90fmClp2fHMN9al4dEIzkHBBhp55QNXxVpbxAO_YPwAPfKytUXGTfJRDIXZpWmLvb17syf9-U4eg0Ofac2wUoOhETlWtMOIU8hShfKDuzZEE5UZluYr9QyjdY-XWVfCcw2&amp;t=634556680204710022" type="text/javascript"></script>
<script src="/TEnterprise/WebResource.axd?d=GiQQDHMpHxEDJMuauFIkN0ds_918hZEH4jumIh8FtanyxDTehsrhvUI779yJfeNwYhdXns8XYNp2ZjJwWqWIy90fmClp2fHMN9al4dEIzkHBBhp55QNXxVpbxAO_YPwAPfKytUXGTfJRDIXZpWmLvb17syf9-U4eg0Ofac2wUoOhETlWtMOIU8hShfKDuzZEE5UZluYr9QyjdY-XWVfCcw2&amp;t=634556680204710022" type="text/javascript"></script>
<script src="../../Core/Common/TInterval.js" type="text/javascript"></script>
<script src="../../Core/Common/TDate.js" type="text/javascript"></script>
<script src="/TEnterprise/WebResource.axd?d=GjUFUJ8se-bj2JpRYbShXPOyCqlmRlifRNiJLA_8FqFA7uBmfEYVKoN6ov5eCVXElBJ11s22PNQZrxf0dSxnfNQaAVomB2D7amSO8t2G_3l-evDdbLB4CW0U_D3ivOf61D0B6V0ytnO48JVcojQyud5T7kzDEQu6YUYLXZhRgPAIr35P0J0h7hUBkYPCN8RlX6SDNAW2owO7hbb7Bm3viQ2&amp;t=634556680204710022" type="text/javascript"></script>
<script type="text/javascript">
//<![CDATA[
 var ErrInDt = 'Date is invalid.'; var OEStr = '27/11/2737'; var jsDoNotPoPuPToMouse = false; TCalendarControl.prototype.MinDateErr = 'The selected date can not be less than the minimum date .'; TCalendarControl.prototype.MaxDateErr = 'The selected date can not be greater than the maximum date .';window['TCalendar_TInterval'] = new TCalendarControl('TCalendar_TInterval');$(function(){$("#TCalendar_TIntervalDate_text").datepicker({dateFormat: top.wndGetParent().top.getDateFormat(),changeMonth: true,changeYear: true,showOtherMonths: true,selectOtherMonths: true,showBottomCombo: true,showAnim: 'fadeIn',language: "0",showOn: 'button',buttonImageOnly: true,buttonImage: '../../Images/cal_1.gif',showOpenEnded: false,onSelect: function(dateText, inst) {window['TCalendar_TInterval'].SetDate(inst.input.attr("oe") == 1 ? new Date(2737, 10, 27) : new Date(inst.selectedYear, inst.selectedMonth, inst.selectedDay));}}).parent().addClass('datePickerCont')});//]]>
</script>

<script src="/TEnterprise/ScriptResource.axd?d=7V-0ZOhasdVjPUtuBNpu9MBFgHX6CKS6hQme21XkkQkOBjXHD9-oAPVGqJeW4iH0I8d2SbIaHE7HaYDmGxEs_WaauAvPwhG0l2dxl-uHHnoaY8Mcl6GnYdh1rMqj_6dMY2JpvGl3deLs1zY3x5kQUgXkmZ4TtjJFDflS1IIGxaU1&amp;t=4edbeeee" type="text/javascript"></script>
<script src="../../core/Common/TTextBoxBase.js" type="text/javascript"></script>
<script  type="text/javascript">
    Glb_PageTimeoutMiliSec = 4000;
</script>
        <textarea name="txtCtrlXML" id="txtCtrlXML" style="display:none;">&lt;page&gt;&lt;fields&gt;&lt;field Id=&quot;CloseBtn&quot; cId=&quot;NavigationLinks_CloseBtn&quot; VIS=&quot;1&quot; ENB=&quot;1&quot; TXT=&quot;Close&quot; /&gt;&lt;field Id=&quot;RefreshBtn&quot; cId=&quot;NavigationLinks_RefreshBtn&quot; VIS=&quot;1&quot; ENB=&quot;1&quot; TXT=&quot;Refresh&quot; /&gt;&lt;field Id=&quot;NotesBtn&quot; cId=&quot;NavigationLinks_NotesBtn&quot; VIS=&quot;1&quot; ENB=&quot;1&quot; TXT=&quot;Notes&quot; /&gt;&lt;field Id=&quot;AssignBtn&quot; cId=&quot;NavigationLinks_AssignBtn&quot; VIS=&quot;1&quot; ENB=&quot;1&quot; TXT=&quot;Assignments&quot; /&gt;&lt;field Id=&quot;TCalendar_TInterval&quot; cId=&quot;TCalendar_TInterval&quot; VIS=&quot;1&quot; ENB=&quot;1&quot; TXT=&quot;18/03/2013 12:00:00 AM&quot; VAL=&quot;18/03/2013 12:00:00 AM&quot; REQ=&quot;0&quot; DRT=&quot;0&quot; /&gt;&lt;field Id=&quot;PreviewCombobox&quot; cId=&quot;PreviewCombobox&quot; VIS=&quot;1&quot; ENB=&quot;1&quot; TXT=&quot;Summarized Personal Timesheet Report&quot; REQ=&quot;0&quot; DRT=&quot;0&quot; /&gt;&lt;field Id=&quot;NONWORKINGTASK_adj&quot; cId=&quot;NONWORKINGTASK_adj&quot; VIS=&quot;1&quot; ENB=&quot;1&quot; TXT=&quot;&quot; REQ=&quot;0&quot; DRT=&quot;0&quot; /&gt;&lt;field Id=&quot;NONWORKINGTASK&quot; cId=&quot;NONWORKINGTASK&quot; VIS=&quot;1&quot; ENB=&quot;1&quot; TXT=&quot;&quot; REQ=&quot;0&quot; DRT=&quot;0&quot; /&gt;&lt;field Id=&quot;PROJECT_adj&quot; cId=&quot;PROJECT_adj&quot; VIS=&quot;1&quot; ENB=&quot;1&quot; TXT=&quot;&quot; REQ=&quot;0&quot; DRT=&quot;0&quot; /&gt;&lt;field Id=&quot;PROJECT&quot; cId=&quot;PROJECT&quot; VIS=&quot;1&quot; ENB=&quot;1&quot; TXT=&quot;&quot; REQ=&quot;0&quot; DRT=&quot;0&quot; /&gt;&lt;field Id=&quot;PROJECT_dup&quot; cId=&quot;PROJECT_dup&quot; VIS=&quot;1&quot; ENB=&quot;1&quot; TXT=&quot;&quot; REQ=&quot;0&quot; DRT=&quot;0&quot; /&gt;&lt;field Id=&quot;TASK_adj&quot; cId=&quot;TASK_adj&quot; VIS=&quot;1&quot; ENB=&quot;1&quot; TXT=&quot;&quot; REQ=&quot;0&quot; DRT=&quot;0&quot; /&gt;&lt;field Id=&quot;TASK&quot; cId=&quot;TASK&quot; VIS=&quot;1&quot; ENB=&quot;1&quot; TXT=&quot;&quot; REQ=&quot;0&quot; DRT=&quot;0&quot; /&gt;&lt;field Id=&quot;TASK_dup&quot; cId=&quot;TASK_dup&quot; VIS=&quot;1&quot; ENB=&quot;1&quot; TXT=&quot;&quot; REQ=&quot;0&quot; DRT=&quot;0&quot; /&gt;&lt;field Id=&quot;CHARGE_adj&quot; cId=&quot;CHARGE_adj&quot; VIS=&quot;1&quot; ENB=&quot;1&quot; TXT=&quot;&quot; REQ=&quot;0&quot; DRT=&quot;0&quot; /&gt;&lt;field Id=&quot;CHARGE&quot; cId=&quot;CHARGE&quot; VIS=&quot;1&quot; ENB=&quot;1&quot; TXT=&quot;&quot; REQ=&quot;0&quot; DRT=&quot;0&quot; /&gt;&lt;field Id=&quot;CHARGE_dup&quot; cId=&quot;CHARGE_dup&quot; VIS=&quot;1&quot; ENB=&quot;1&quot; TXT=&quot;&quot; REQ=&quot;0&quot; DRT=&quot;0&quot; /&gt;&lt;/fields&gt;&lt;/page&gt;</textarea>
        
        <?xml version="1.0" encoding="utf-16"?><div id="NavigationLinks" class="BtnListDiv" xmlns:fn="http://www.w3.org/2005/02/xpath-functions" xmlns:tt="uri:tenrox.com/TimesheetTemplate.xsd">
	<ul class="btn_list"><li><span id="NavigationLinks_CloseBtn" class="lnk" V="0" BL="1" title="Close" TNX="1" btype="lnk" oncontextmenu CEN="1" onclick="Close_Timesheet_Template_Window();" CMV="1" validate="1" style="text-align:center;">Close</span><script language="javascript" type="text/javascript">window["NavigationLinks_CloseBtn"] = new TButton("NavigationLinks_CloseBtn");</script></li><li>|</li><li><span id="NavigationLinks_RefreshBtn" class="lnk" V="0" BL="1" title="Refresh" TNX="1" btype="lnk" oncontextmenu CEN="1" onclick="try{oTTimesheet.Refresh()}catch(e){};" CMV="1" validate="1" style="text-align:center">Refresh</span><script language="javascript" type="text/javascript">window["NavigationLinks_RefreshBtn"] = new TButton("NavigationLinks_RefreshBtn");</script></li><li>|</li><li><span id="NavigationLinks_NotesBtn" class="lnk" V="0" BL="1" title="Notes" TNX="1" btype="lnk" oncontextmenu CEN="1" onclick="try{oTTimesheet.ShowNotes();}catch(e){};" CMV="1" validate="1" style="text-align:center">Notes</span><script language="javascript" type="text/javascript">window["NavigationLinks_NotesBtn"] = new TButton("NavigationLinks_NotesBtn");</script></li><li>|</li><li><span id="NavigationLinks_AssignBtn" class="lnk" V="0" BL="1" title="Assignments" TNX="1" btype="lnk" oncontextmenu CEN="1" onclick="try{oTTimesheet.Assignments();}catch(e){};" CMV="1" validate="1" style="text-align:center">Assignments</span><script language="javascript" type="text/javascript">window["NavigationLinks_AssignBtn"] = new TButton("NavigationLinks_AssignBtn");</script></li></ul>
</div><span id="TimesheetOfLable" class="TimesheetOf" xmlns:fn="http://www.w3.org/2005/02/xpath-functions" xmlns:tt="uri:tenrox.com/TimesheetTemplate.xsd" style="display:none;"> Hazleton, Stephen</span><div xmlns:fn="http://www.w3.org/2005/02/xpath-functions"    xmlns:tt="uri:tenrox.com/TimesheetTemplate.xsd"><table class="Label"><tr><td width="250"><span id="TInterval"><table id="TInterval_events" onClientDateChanged="TimesheetPeriodChanged" border="0">
	<tr>
		<td class="TIntervalText" nowrap="true">Period:</td><td><img class='TIntervalB' onclick='OnClientTIntervalDateChanged("TInterval",-1);' src='../../Images/cal2_l.gif' alt='' /></td><td><script type="text/javascript" src="../../Core/Common/TTextBox.js"></script><span id="TInterval_SD_wrpr"><input name="TInterval_SD" value="18/03/2013" maxlength="255" readonly="readonly" id="TInterval_SD" class="InnerTextSetting95" name="TInterval_SD" onblur="_CLS(this); " LBL="" type="TTextBox" TNX="1" tgd="1" CEN="1" valueh="03/18/2013" vel="" SRI="0" CMV="1" Required="0" style="width:70px;align:center;" /><script type="text/javascript">window['TInterval_SD'] = new Tenrox.TTextBox('TInterval_SD');</script><span id="TInterval_SD_REQ" class="ReqIndicator" style="display:none;">&nbsp;*</span></span></td><td><span id="TInterval_ED_wrpr"><input name="TInterval_ED" value="24/03/2013" maxlength="255" readonly="readonly" id="TInterval_ED" class="InnerTextSetting95" name="TInterval_ED" onblur="_CLS(this); " LBL="" type="TTextBox" TNX="1" tgd="1" CEN="1" valueh="03/24/2013" vel="" SRI="0" CMV="1" Required="0" style="width:70px;align:center;" /><script type="text/javascript">window['TInterval_ED'] = new Tenrox.TTextBox('TInterval_ED');</script><span id="TInterval_ED_REQ" class="ReqIndicator" style="display:none;">&nbsp;*</span></span></td><td><img class='TIntervalB' onclick='OnClientTIntervalDateChanged("TInterval", 1);' src='../../Images/cal2_r.gif' alt='' /></td><td><span id="TCalendar_TInterval"><table cellpadding="0" class="calendar_cont to" id="TCalendar_TInterval_table"><tr><td><span id="TCalendar_TIntervalDate_wrapper" class="radInput_Tenrox" style="white-space:nowrap;"><!-- 2.1.4 --><script type="text/javascript" src="/TEnterprise/WebResource.axd?d=nl68N1iULFo0yHql_imI7k24KPQlmEEtjNCAO19smlQRabPWx3YyeDBxo0_e5LZcDRSa6JTXJ6hUFyHP4RqWsNtDPyqNI1oFH0LMNcBXzvPsmpW0rK8eqFxv1xh-n7Qf92wxIfo4DHOWpwjRIOafpDiacMf6dN88u7FjUvTlY-t5yiguasbjuMyvW13yxHqy0&amp;t=634498881360000000"></script><script type="text/javascript" src="/TEnterprise/WebResource.axd?d=OgtukgR-iEOB7P4xpFV6nr-EFNXYFtmSgU8c2bv8V8aVQv0JE0dGAK8ijbKl-OX1bJ-XDoq1oJEtZQFXYcmgQpsZ6k9_QLTy3Ip0oO6MQpvs3nwM2kykBILN5yLUWITZd6LixtRukRUg7E8aJ0Rw5TbQoUW1JKmFXGqeVEoO-FGZxxMB4-CFLmfYj7QwS-Vk0&amp;t=634498881360000000"></script><span id="TCalendar_TIntervalDateStyleSheetHolder" style="display:none;"></span><input id="TCalendar_TIntervalDate_text" Required ="0" SRI="0" CEN="1" CMV="1" OEE="0" CE="0" validate="0" vel=""tnxtype="cal"class="radEnabledCss_Tenrox MaskEditStyle inputCell" RDCE="onbeforeDSel" style="width:80px;" /><input style="visibility:hidden;margin:-18px 0 0 0;width:1px;height:1px;overflow:hidden;border:0;padding:0;" id="TCalendar_TIntervalDate" name="TCalendar_TIntervalDate" type="text" value="2013-03-18-00-00-00" /><script type="text/javascript">window["TCalendar_TIntervalDate"] = new RadDateInput("TCalendar_TIntervalDate", {"IncrementSettings":{"Step":1,"InterceptArrowKeys":true,"InterceptMouseWheel":true},"DateTimeFormatInfo":{"TimeSeparator":":","AMDesignator":"AM","PMDesignator":"PM","DayNames":["Sunday","Monday","Tuesday","Wednesday","Thursday","Friday","Saturday"],"MonthNames":["January","February","March","April","May","June","July","August","September","October","November","December",""],"AbbreviatedDayNames":["Sun","Mon","Tue","Wed","Thu","Fri","Sat"],"AbbreviatedMonthNames":["Jan","Feb","Mar","Apr","May","Jun","Jul","Aug","Sep","Oct","Nov","Dec",""],"FirstDayOfWeek":"Sunday","DateSeparator":"/","DateSlots":{"Month":1,"Day":0,"Year":2},"TimeInputOnly":false,"ShortYearCenturyEnd":2029},"DisplayDateFormat":"dd/MM/yyyy","DateFormat":"dd/MM/yyyy","MinDate":[1990,1,1,0,0,0],"MaxDate":[2737,11,27,0,0,0],"AutoPostBack":false,"EmptyMessage":"","SelectionOnFocus":0,"ClientEvents":{"OnError":"OnDateError","OnButtonClick":"","OnLoad":"AchChgEvt","OnMouseOut":"","OnMouseOver":"","OnFocus":"","OnBlur":"","OnDisable":"","OnEnable":"","OnValueChanged":"RaiseValueChanged","OnKeyPress":"","OnEnumerationChanged":"","OnMoveUp":"","OnMoveDown":"","OnShowHint":""},"ShowButton":false,"ButtonsPosition":1,"Enabled":true,"PostBackEventReferenceScript":""}, {HoveredStyle: ["width:80px;", "radHoverCss_Tenrox MaskEditStyle inputCell"],InvalidStyle: ["width:80px;", "radInvalidCss_Tenrox MaskEditStyle inputCell"],DisabledStyle: ["width:80px;", "radDisabledCss_Tenrox MaskEditStyle inputCell"],FocusedStyle: ["width:80px;", "radFocusedCss_Tenrox MaskEditStyle inputCell"],EmptyMessageStyle: ["width:80px;", "radEmptyMessageCss_Tenrox MaskEditStyle inputCell"],EnabledStyle: ["width:80px;", "radEnabledCss_Tenrox MaskEditStyle inputCell"]});window["TCalendar_TIntervalDate"].OriginalValue = '18/03/2013 12:00:00 AM';</script></span></td><td><span class="ReqIndicator" style="Visibility:hidden" id="TCalendar_TIntervalReq" >&nbsp;*</span></td></tr></table></span></td>
	</tr>
</table></span></td><td><span id="PreviewLabel" class="TIntervalText">Report:</span></td><td><div id="PreviewCombobox_wrapper" style="display:inline">
	<!-- 2.8.6 --><script type="text/javascript" src="/TEnterprise/WebResource.axd?d=NmNchnb_6eK_xgH9qY8rsL2askOKd55-UJ1XwGupmx8k4HHb_VkB4Fd5GlyOyRXTojwQ4m1n3pDb3lb13LKPAR2R27Bk0KUM3JNU5GZ2Eq-wV_wl0Pd1o8fibhrahuBnKTfBLk03vl7LuIhCbJg1VxQ2v9frxyx0J_8TM462iYfE3yN79UpizpXXg-96PJ1d0&amp;t=634498881360000000"></script><div class="ComboBox_Tenrox" id="PreviewCombobox" style="display:inline; white-space: nowrap;"><input type="text" id="PreviewCombobox_Input" Required ="0" SRI="0" CEN="1" CMV="1" validate="0" vel=""tgd="1" axp="1" grd="0" tnxtype="cmb"TNX="1"name="PreviewCombobox_Input" value="Summarized Personal Timesheet Report" class="ComboBoxInput_Tenrox" style="width:177px;" readonly="readonly" /><img alt="" id="PreviewCombobox_Image" src="/TEnterprise/RadControls/ComboBox/Skins/Tenrox/DropArrow.gif" class="ComboBoxImage_Tenrox" /><div id="PreviewCombobox_DropDownPlaceholder" style="position:absolute; display: none; z-index: 300;" class="ComboBoxDropDown_Tenrox"><div id="PreviewCombobox_DropDown" style="overflow:auto;height:100px;white-space:nowrap;"><div id="PreviewCombobox_c0" class="ComboBoxItem_Tenrox">
	Timesheet Overview
</div><div id="PreviewCombobox_c1" class="ComboBoxItem_Tenrox">
	Summarized Personal Timesheet Report
</div><div id="PreviewCombobox_c2" class="ComboBoxItem_Tenrox">
	Personal Leave Time
</div></div></div><span id="PreviewComboboxStyleSheetHolder" style="display:none;"></span></div><input type="hidden" name="PreviewCombobox_value" id="PreviewCombobox_value" value="642" /><input type="hidden" name="PreviewCombobox_text" id="PreviewCombobox_text" value="Summarized Personal Timesheet Report" /><input type="hidden" name="PreviewCombobox_clientWidth" id="PreviewCombobox_clientWidth" value="" /><input type="hidden" name="PreviewCombobox_clientHeight" id="PreviewCombobox_clientHeight" value="" /><script type="text/javascript">window["PreviewCombobox"] = new RadComboBox("PreviewCombobox","PreviewCombobox",true);window["PreviewCombobox"].Initialize({"LoadOnDemandUrl":"/TEnterprise/Entry/TimeEntry/TimeTemplate.aspx?UserUId=367&SD=03/24/2013&ROBJT=26&r=0.3009296082891524&pageKey=a75440cc15c458200248c44ec0c24fd7%26rcbID=PreviewCombobox%26rcbServerID=PreviewCombobox","ItemRequestTimeout":800,"PostBackReference":"__doPostBack('PreviewCombobox','TextChange')","Skin":"Tenrox","SelectedIndex":1,"OffsetX":2,"OffsetY":1,"Enabled":true,"ScrollDownImage":"/TEnterprise/RadControls/ComboBox/Skins/Tenrox/ScrollDown.gif","ScrollDownImageDisabled":"/TEnterprise/RadControls/ComboBox/Skins/Tenrox/ScrollDownDisabled.gif"},[{"Text":"Timesheet Overview","Value":"556","ClientID":"PreviewCombobox_c0"},{"Text":"Summarized Personal Timesheet Report","Value":"642","Selected":true,"ClientID":"PreviewCombobox_c1"},{"Text":"Personal Leave Time","Value":"712","ClientID":"PreviewCombobox_c2"}]);</script>
</div></td><td><img src="../../Images/ReportsPreview.gif" border="0" onclick="try{oTTimesheet.ShowReport(PreviewCombobox)}catch(e){}" align="left" tabindex="0" style="cursor:pointer;cursor:hand;" /></td><td><span id="msgOnCompleat" /></td></tr></table></div><script type="text/javascript" xmlns:fn="http://www.w3.org/2005/02/xpath-functions"    xmlns:tt="uri:tenrox.com/TimesheetTemplate.xsd">
      var resPath='../../images';
    </script><div class="exp_cont expanded" xmlns:fn="http://www.w3.org/2005/02/xpath-functions"    xmlns:tt="uri:tenrox.com/TimesheetTemplate.xsd"><img src="../../images/psr_minus1.gif" alt="" class="minus" onclick="collapseExpand(this)" /><img src="../../images/plus2.gif" alt="" class="plus" onclick="collapseExpand(this)" /><span class="expand_title" onclick="collapseExpand(this)">Leave Time Summary</span></div><table id="daLeaveTimeSummary" border="0" cellpadding="2" class="Label" style="display:none;" xmlns:fn="http://www.w3.org/2005/02/xpath-functions"    xmlns:tt="uri:tenrox.com/TimesheetTemplate.xsd"><tr><td><div class="tit_cont"><b class="Rnd_"><b class="Rnd1_">1</b><b class="Rnd2_">2</b><b class="Rnd3_">3</b><b class="Rnd4_">4</b></b><div class="rndCornerCont_"><b class="leg_field">Time Used for</b><table border="0" cellpadding="2" class="Label"><tr><td colspan="2" class="delimiter"><div /></td></tr><tr><td align="right">Holiday:</td><td align="left"><span id="LTS_5_used">49:00 hrs</span></td></tr><tr><td align="right">Sick Leave:</td><td align="left"><span id="LTS_56_used">00:00 hrs</span></td></tr></table></div><b class="Rnd_"><b class="Rnd4_">1</b><b class="Rnd3_">2</b><b class="Rnd2_">3</b><b class="Rnd1_">4</b></b></div></td><td><div class="tit_cont"><b class="Rnd_"><b class="Rnd1_">1</b><b class="Rnd2_">2</b><b class="Rnd3_">3</b><b class="Rnd4_">4</b></b><div class="rndCornerCont_"><b class="leg_field">Time Remaining for</b><table border="0" cellpadding="2" class="Label"><tr><td colspan="2" class="delimiter"><div /></td></tr><tr><td align="right">Holiday:</td><td align="left"><span id="LTS_5_remaining">-162:00 hrs</span></td></tr><tr><td align="right">Sick Leave:</td><td align="left"><span id="LTS_56_remaining">-07:30 hrs</span></td></tr></table></div><b class="Rnd_"><b class="Rnd4_">1</b><b class="Rnd3_">2</b><b class="Rnd2_">3</b><b class="Rnd1_">4</b></b></div></td><td><div class="tit_cont"><b class="Rnd_"><b class="Rnd1_">1</b><b class="Rnd2_">2</b><b class="Rnd3_">3</b><b class="Rnd4_">4</b></b><div class="rndCornerCont_"><b class="leg_field">Time Available For</b><table border="0" cellpadding="2" class="Label"><tr><td colspan="2" class="delimiter"><div /></td></tr><tr><td align="right">Holiday:</td><td align="left"><span id="LTS_5_available">-162:00 hrs</span></td></tr><tr><td align="right">Sick Leave:</td><td align="left"><span id="LTS_56_available">-07:30 hrs</span></td></tr></table></div><b class="Rnd_"><b class="Rnd4_">1</b><b class="Rnd3_">2</b><b class="Rnd2_">3</b><b class="Rnd1_">4</b></b></div></td></tr></table><div class="exp_cont" xmlns:fn="http://www.w3.org/2005/02/xpath-functions"    xmlns:tt="uri:tenrox.com/TimesheetTemplate.xsd"><img src="../../images/psr_minus1.gif" alt="" class="minus" onclick="collapseExpandTS(this)" /><img src="../../images/plus2.gif" alt="" class="plus" onclick="collapseExpandTS(this)" /><span class="expand_title" onclick="collapseExpandTS(this)">Timesheet</span><span id="curTimesheetName">
                (<span id="StatusLable" class="TimesheetOf" onclick="oTTimesheet.ShowStateAssignment(event);">Approved</span>)
              </span><span id="PeriodisClosedLable" class="TimesheetOf"></span></div><div id="daTaskTimeEntry" xmlns:fn="http://www.w3.org/2005/02/xpath-functions"    xmlns:tt="uri:tenrox.com/TimesheetTemplate.xsd"><div id="TSControl1"></div><textarea id="TSControl1Layout" style="display:none"><TimesheetLayout uid="1001" name="OpenBet Full time TS Template" UserUId="367" LogUserUId="367" Lng="0" UserHireDate="06/28/2010" UserTerminationDate="11/27/2737"><Cols><C d="1" ro="0" w="70" so="0" sd="0" loc="Left"></C><C d="1" ro="0" w="250" so="1" sd="0" loc="Left"></C><C d="1" ro="0" w="250" so="3" sd="0" loc="Left"></C><C d="1" ro="0" w="65" so="0" sd="0" loc="Left"></C><C d="1" ro="0" w="160" so="0" sd="0" loc="Left"></C><C d="1" ro="0" w="50" loc="Middle"></C><C d="1" ro="0" w="50" loc="Middle"></C><C d="1" ro="0" w="50" loc="Middle"></C><C d="1" ro="0" w="50" loc="Middle"></C><C d="1" ro="0" w="50" loc="Middle"></C><C d="1" ro="0" w="50" loc="Middle"></C><C d="1" ro="0" w="50" loc="Middle"></C><C d="1" w="50" loc="Right"></C></Cols><Containers><C r="1" minw="10000" maxw="-1" rp="0"></C><C r="1" minw="10000" maxw="-1" rp="1"></C><C r="0"></C></Containers><DisplayArea id="TaskTimeEntry" showAssignments="true" showAdjustments="true" bh="-1"><Header><Rows><R><Cols><C colspan="5" val="Timesheet"></C><C val="Mon"></C><C val="Tue"></C><C val="Wed"></C><C val="Thu"></C><C val="Fri"></C><C val="Sat"></C><C val="Sun"></C></Cols></R><R><Cols><C val=""></C><C val="My Projects" sort="1"></C><C val="Task" sort="1"></C><C val="ETC" sort="1"></C><C val="Charge" sort="1"></C><C val="03/18" inxkey="03/18/2013"></C><C val="03/19" inxkey="03/19/2013"></C><C val="03/20" inxkey="03/20/2013"></C><C val="03/21" inxkey="03/21/2013"></C><C val="03/22" inxkey="03/22/2013"></C><C val="03/23" inxkey="03/23/2013"></C><C val="03/24" inxkey="03/24/2013"></C><C val="Total"></C></Cols></R></Rows></Header><LeftSection><GBody><Row d="0"><C type="TIMGCTRLS" cid="ImgCtrls" dispkey="" uidkey="" disabled="0" loadtype="1"><src procn="" keyn="" keyval=""></src></C><C type="combobox" cid="PROJECT" dispkey="PROJECT_NAME" uidkey="PROJECT_UID" disabled="0" loadtype="1"><src procn="TEMPLATEQLOADLIST" keyn="NAME" keyval="UNIQUEID"><p v="oTTimesheet.LoggedUserUId()" t="int"></p><p v="oTTimesheet.UserUId()" t="int"></p><p v="oTTimesheet.Language()" t="int"></p><p v="'MYPROJECT'" t="str"></p><p v="2" t="int"></p><p v="oTTimesheet.StartDate()" t="Date"></p><p v="oTTimesheet.EndDate()" t="Date"></p><p v="-1" t="int"></p><p v="-1" t="int"></p><p v="-1" t="int"></p><p v="-1" t="int"></p><p v="eval('CLIENT').GetValue();" t="int"></p><p v="-1" t="int"></p><p v="-1" t="int"></p></src></C><C type="combobox" cid="TASK" dispkey="TASK_NAME" uidkey="TASK_UID" disabled="1" loadtype="0"><src procn="TEMPLATEQLOADLIST" keyn="NAME" keyval="UNIQUEID"><p v="oTTimesheet.LoggedUserUId()" t="int"></p><p v="oTTimesheet.UserUId()" t="int"></p><p v="oTTimesheet.Language()" t="int"></p><p v="'TASK'" t="str"></p><p v="10" t="int"></p><p v="oTTimesheet.StartDate()" t="Date"></p><p v="oTTimesheet.EndDate()" t="Date"></p><p v="-1" t="int"></p><p v="-1" t="int"></p><p v="-1" t="int"></p><p v="-1" t="int"></p><p v="eval('PROJECT').GetValue();" t="int"></p><p v="eval('WORKTYPE').GetValue();" t="int"></p><p v="eval('CLIENT').GetValue();" t="int"></p></src></C><C type="TINPETC" cid="etc" dispkey="etc" uidkey="auid" disabled="0" loadtype="0"><src procn="" keyn="" keyval=""></src></C><C type="combobox" cid="CHARGE" dispkey="CHARGE_NAME" uidkey="CHARGE_UNIQUEID" disabled="0" loadtype="1"><src procn="TEMPLATEQITEMS" keyn="NAME" keyval="UNIQUEID"><p v="oTTimesheet.LoggedUserUId()" t="int"></p><p v="oTTimesheet.UserUId()" t="int"></p><p v="oTTimesheet.Language()" t="int"></p><p v="'CHARGE'" t="str"></p><p v="oTTimesheet.StartDate()" t="Date"></p><p v="oTTimesheet.EndDate()" t="Date"></p></src></C></Row></GBody><Dependencies><C id="PROJECT" desc="My Projects" enabling="true"><C id="TASK" desc="Task" enabling="true"></C></C></Dependencies><RequiredControls><C id="PROJECT" desc="My Projects"></C><C id="TASK" desc="Task"></C></RequiredControls></LeftSection><MiddleSection><Rules><Rule control="MiddleSectionCell" action="post" type="onbeforechange"><R script="ClientSideCellEntryRulePostOvertimeCheck();" type="none"></R><R script="ClientSideCellEntryRulePostIsRejected();" type="none"></R><R script="ClientSideCellEntryRulePostEntryNotByOwner(oExceptionType.Notification);" type="none"></R></Rule><Rule control="MiddleSectionCell" action="post" type="ontimeentryload"><R script="ClientSideCellEntryRulePostOvertimeCheck();" type="none"></R><R script="ClientSideCellEntryRulePostIsRejected();" type="none"></R><R script="ClientSideCellEntryRulePostEntryNotByOwner(oExceptionType.Notification);" type="none"></R></Rule></Rules></MiddleSection></DisplayArea><DisplayArea id="NonWorkingTimeEntry" bh="-1"><Header><Rows><R><Cols><C colspan="5" val="Non-Working Time"></C><C val="Mon"></C><C val="Tue"></C><C val="Wed"></C><C val="Thu"></C><C val="Fri"></C><C val="Sat"></C><C val="Sun"></C></Cols></R><R><Cols><C colspan="5" val="&amp;nbsp;"></C><C val="03/18" inxkey="03/18/2013"></C><C val="03/19" inxkey="03/19/2013"></C><C val="03/20" inxkey="03/20/2013"></C><C val="03/21" inxkey="03/21/2013"></C><C val="03/22" inxkey="03/22/2013"></C><C val="03/23" inxkey="03/23/2013"></C><C val="03/24" inxkey="03/24/2013"></C><C val="Total"></C></Cols></R></Rows></Header><LeftSection><GBody><Row d="0"><C colspan="5" type="combobox" cid="NONWORKINGTASK" dispkey="TASK_NAME" uidkey="TASK_UID" disabled="0" cls="NonWB"><src procn="TIMETEMPNONWORKINGTASK" keyn="NAME" keyval="UNIQUEID"><p v="oTTimesheet.UserUId()" t="int"></p><p v="oTTimesheet.StartDate()" t="Date"></p><p v="oTTimesheet.EndDate()" t="Date"></p><p v="oTTimesheet.TemplateUID()" t="int"></p><p v="0" t="int"></p></src></C></Row></GBody><Dependencies></Dependencies><RequiredControls><C id="NONWORKINGTASK" desc="Non-Working Time" enabling="true"></C></RequiredControls></LeftSection><MiddleSection><Rules><Rule control="MiddleSectionCell" action="post" type="onbeforechange"><R script="ClientSideCellEntryRulePostIsRejected();" type="none"></R></Rule><Rule control="MiddleSectionCell" action="post" type="ontimeentryload"><R script="ClientSideCellEntryRulePostIsRejected();" type="none"></R></Rule></Rules></MiddleSection></DisplayArea><Footer><Rows><R d="1" rtype="RT" cls=""><Cols><C colspan="5" val="Regular" cls="TotalRowText"></C><C val="0.00"></C><C val="0.00"></C><C val="0.00"></C><C val="0.00"></C><C val="0.00"></C><C val="0.00"></C><C val="0.00"></C><C val="0.00"></C></Cols></R><R d="1" rtype="CT" cls=""><Cols><C colspan="5" val="Adjustment" cls="TotalRowText"></C><C val="0.00"></C><C val="0.00"></C><C val="0.00"></C><C val="0.00"></C><C val="0.00"></C><C val="0.00"></C><C val="0.00"></C><C val="0.00"></C></Cols></R><R d="1" rtype="OT" cls=""><Cols><C colspan="5" val="Overtime" cls="TotalRowText"></C><C val="0.00"></C><C val="0.00"></C><C val="0.00"></C><C val="0.00"></C><C val="0.00"></C><C val="0.00"></C><C val="0.00"></C><C val="0.00"></C></Cols></R><R d="1" rtype="DOT" cls=""><Cols><C colspan="5" val="Double Overtime" cls="TotalRowText"></C><C val="0.00"></C><C val="0.00"></C><C val="0.00"></C><C val="0.00"></C><C val="0.00"></C><C val="0.00"></C><C val="0.00"></C><C val="0.00"></C></Cols></R><R d="1" rtype="GT" cls=""><Cols><C colspan="5" val="Total" cls="TotalRowText"></C><C val="0.00" cls="GTotalRowTime"></C><C val="0.00" cls="GTotalRowTime"></C><C val="0.00" cls="GTotalRowTime"></C><C val="0.00" cls="GTotalRowTime"></C><C val="0.00" cls="GTotalRowTime"></C><C val="0.00" cls="GTotalRowTime"></C><C val="0.00" cls="GTotalRowTime"></C><C val="0.00" cls="GTotalRowTime"></C></Cols></R></Rows></Footer><Settings><General hoursPerDay="27000" workflowId="3" defaultReportTemplate="642"></General><Setup showNotes="true" canAttachDocToTimesheet="false" canAttachDocToTimeEntries="false" canAttachDocToAssigments="false" trackInOutThroughPunch="false"></Setup><Options allowUpdateAssignmentsDatesFromTimesheet="false" displayAssignmentsWithTime="false" etcColor="#99ccff" timeEntryUnits="time" timeEntryUnitsFormat="decimal" defaultToEarliestAssignedTimesheet="true" allowUpdateAssignedTasks="true" allowModifyETCThroughChangeRequest="false" allowCopyTimesheet="false" showOvertime="false" showDoubleOvertime="false" enableOvertimeProcessing="true" canEnterAdjustments="false" autoPunchOut="false" enforceCycle="2"></Options></Settings></TimesheetLayout></textarea><textarea id="TSControl1Data" style="display:none"><Timesheet ISMULTIPMAPP="0" UID="112994" PERIODTYPE="W" TWINSTGUID="8BBC2A53-7203-4EE9-9815-1762EAEF71A5" TWFUID="3" ISTIMECLOSED="0" OBJTYPE="26" ASSIGNOBJECTTYPEUID="-1" MGRCANMODIFYBILL="0" MGRCANMODIFYPAY="0" MGRCANCRTIMECHARGES="0" TIMECHARGEREADONLY="0" CANMODIFYPUNCHENTRIES="0" CANCREATETASK="0" COUNTPROJECT="6" PMASSIGNED="0"><Assignments><ass ASSNATRIBUID="70234" TEMPLUID="1001" ISDEFAULT="1" ASS_UID="63932" ASS_NAME="BBT300 Investigation" STARTDATE="09/10/2012" ENDDATE="11/27/2737" SDATE="2012-09-10T00:00:00" EDATE="2737-11-27T00:00:00" ETC="3600" ASSCOMP="0" USERID="367" TASK_UID="40666" TASK_NAME="BBT300 Investigation" SHOWETC="0" TACCETYPE="1" TSTARTDATE="06/03/2008" TENDDATE="11/27/2737" PROJECT_UID="1387" PROJECT_NAME="BBT300 - Balkanbet Support" ISETCEDIT="1" MGRUID="602" PMGRE="robert.sutherland@openbet.com" PMGRFN="Robert" PMGRLN="Sutherland-Smith" CLIENT_UID="63" CLIENT_NAME="Balkan Bet" WORKTYPE_UID="10077" WORKTYPE_NAME="Support (u)" ISNONWORKINGTIME="0" PCOMPLETE="100" TASK_DESCRIPTION="" ISTPPSYNC="0" REQUESTCHANGEID="-1" HASPENDINGREQUEST="0" REQUESTSTARTDATE="01/01/1900" REQUESTENDDATE="01/01/1900" CHARGE_UNIQUEID="0" CHARGE_NAME="" CHARGE_STATUS="0" HASTIME="0" /><ass ASSNATRIBUID="103208" TEMPLUID="1001" ISDEFAULT="1" ASS_UID="95273" ASS_NAME="BF300 Investigation" STARTDATE="03/18/2013" ENDDATE="11/27/2737" SDATE="2013-03-18T00:00:00" EDATE="2737-11-27T00:00:00" ETC="7200" ASSCOMP="0" USERID="367" TASK_UID="40706" TASK_NAME="BF300 Investigation" SHOWETC="0" TACCETYPE="1" TSTARTDATE="09/27/2008" TENDDATE="11/27/2737" PROJECT_UID="1414" PROJECT_NAME="BF300 - BetFair Support" ISETCEDIT="1" MGRUID="602" PMGRE="robert.sutherland@openbet.com" PMGRFN="Robert" PMGRLN="Sutherland-Smith" CLIENT_UID="117" CLIENT_NAME="Betfair Games" WORKTYPE_UID="10077" WORKTYPE_NAME="Support (u)" ISNONWORKINGTIME="0" PCOMPLETE="100" TASK_DESCRIPTION="" ISTPPSYNC="0" REQUESTCHANGEID="-1" HASPENDINGREQUEST="0" REQUESTSTARTDATE="01/01/1900" REQUESTENDDATE="01/01/1900" CHARGE_UNIQUEID="0" CHARGE_NAME="" CHARGE_STATUS="0" HASTIME="1" NOTEOPTION="TEMPLATESETTINGS" /><ass ASSNATRIBUID="80378" TEMPLUID="1001" ISDEFAULT="1" ASS_UID="72703" ASS_NAME="COR300 Investigation" STARTDATE="11/01/2012" ENDDATE="11/27/2737" SDATE="2012-11-01T00:00:00" EDATE="2737-11-27T00:00:00" ETC="0" ASSCOMP="0" USERID="367" TASK_UID="43965" TASK_NAME="COR300 Investigation" SHOWETC="0" TACCETYPE="1" TSTARTDATE="10/01/2012" TENDDATE="11/27/2737" PROJECT_UID="5789" PROJECT_NAME="COR300 - Coral Support" ISETCEDIT="1" MGRUID="602" PMGRE="robert.sutherland@openbet.com" PMGRFN="Robert" PMGRLN="Sutherland-Smith" CLIENT_UID="144" CLIENT_NAME="Coral" WORKTYPE_UID="10077" WORKTYPE_NAME="Support (u)" ISNONWORKINGTIME="0" PCOMPLETE="100" TASK_DESCRIPTION="" ISTPPSYNC="0" REQUESTCHANGEID="-1" HASPENDINGREQUEST="0" REQUESTSTARTDATE="01/01/1900" REQUESTENDDATE="01/01/1900" CHARGE_UNIQUEID="0" CHARGE_NAME="" CHARGE_STATUS="0" HASTIME="0" /><ass ASSNATRIBUID="18685" TEMPLUID="1001" ISDEFAULT="1" ASS_UID="16985" ASS_NAME="GEN - Desk Move" STARTDATE="08/01/2011" ENDDATE="11/27/2737" SDATE="2011-08-01T00:00:00" EDATE="2737-11-27T00:00:00" ETC="0" ASSCOMP="0" USERID="367" TASK_UID="15606" TASK_NAME="GEN - Desk Move" SHOWETC="0" TACCETYPE="1" TSTARTDATE="01/01/2010" TENDDATE="11/27/2737" PROJECT_UID="2" PROJECT_NAME="General" ISETCEDIT="0" MGRUID="0" PMGRE="" PMGRFN="" PMGRLN="" CLIENT_UID="1" CLIENT_NAME="Internal" WORKTYPE_UID="10060" WORKTYPE_NAME="General (u)" ISNONWORKINGTIME="0" PCOMPLETE="100" TASK_DESCRIPTION="" ISTPPSYNC="0" REQUESTCHANGEID="-1" HASPENDINGREQUEST="0" REQUESTSTARTDATE="01/01/1900" REQUESTENDDATE="01/01/1900" CHARGE_UNIQUEID="0" CHARGE_NAME="" CHARGE_STATUS="0" HASTIME="0" /><ass ASSNATRIBUID="12879" TEMPLUID="1001" ISDEFAULT="1" ASS_UID="12910" ASS_NAME="GEN - PC problems" STARTDATE="07/01/2011" ENDDATE="11/27/2737" SDATE="2011-07-01T00:00:00" EDATE="2737-11-27T00:00:00" ETC="10800" ASSCOMP="0" USERID="367" TASK_UID="331" TASK_NAME="GEN - PC problems" SHOWETC="0" TACCETYPE="1" TSTARTDATE="01/01/2010" TENDDATE="11/27/2737" PROJECT_UID="2" PROJECT_NAME="General" ISETCEDIT="0" MGRUID="0" PMGRE="" PMGRFN="" PMGRLN="" CLIENT_UID="1" CLIENT_NAME="Internal" WORKTYPE_UID="10060" WORKTYPE_NAME="General (u)" ISNONWORKINGTIME="0" PCOMPLETE="100" TASK_DESCRIPTION="" ISTPPSYNC="0" REQUESTCHANGEID="-1" HASPENDINGREQUEST="0" REQUESTSTARTDATE="01/01/1900" REQUESTENDDATE="01/01/1900" CHARGE_UNIQUEID="0" CHARGE_NAME="" CHARGE_STATUS="0" HASTIME="0" /><ass ASSNATRIBUID="60998" TEMPLUID="1001" ISDEFAULT="1" ASS_UID="54556" ASS_NAME="GEN - Recruitment" STARTDATE="07/09/2012" ENDDATE="11/27/2737" SDATE="2012-07-09T00:00:00" EDATE="2737-11-27T00:00:00" ETC="900" ASSCOMP="0" USERID="367" TASK_UID="15608" TASK_NAME="GEN - Recruitment" SHOWETC="0" TACCETYPE="1" TSTARTDATE="01/01/2010" TENDDATE="11/27/2737" PROJECT_UID="2" PROJECT_NAME="General" ISETCEDIT="0" MGRUID="0" PMGRE="" PMGRFN="" PMGRLN="" CLIENT_UID="1" CLIENT_NAME="Internal" WORKTYPE_UID="10062" WORKTYPE_NAME="Interview (u)" ISNONWORKINGTIME="0" PCOMPLETE="100" TASK_DESCRIPTION="" ISTPPSYNC="0" REQUESTCHANGEID="-1" HASPENDINGREQUEST="0" REQUESTSTARTDATE="01/01/1900" REQUESTENDDATE="01/01/1900" CHARGE_UNIQUEID="0" CHARGE_NAME="" CHARGE_STATUS="0" HASTIME="0" /><ass ASSNATRIBUID="103209" TEMPLUID="1001" ISDEFAULT="1" ASS_UID="95274" ASS_NAME="JEN300 Investigation" STARTDATE="03/18/2013" ENDDATE="11/27/2737" SDATE="2013-03-18T00:00:00" EDATE="2737-11-27T00:00:00" ETC="13500" ASSCOMP="0" USERID="367" TASK_UID="40774" TASK_NAME="JEN300 Investigation" SHOWETC="0" TACCETYPE="1" TSTARTDATE="05/05/2008" TENDDATE="11/27/2737" PROJECT_UID="959" PROJECT_NAME="JEN300 - Jennings Support" ISETCEDIT="1" MGRUID="602" PMGRE="robert.sutherland@openbet.com" PMGRFN="Robert" PMGRLN="Sutherland-Smith" CLIENT_UID="73" CLIENT_NAME="Jennings" WORKTYPE_UID="10077" WORKTYPE_NAME="Support (u)" ISNONWORKINGTIME="0" PCOMPLETE="100" TASK_DESCRIPTION="" ISTPPSYNC="0" REQUESTCHANGEID="-1" HASPENDINGREQUEST="0" REQUESTSTARTDATE="01/01/1900" REQUESTENDDATE="01/01/1900" CHARGE_UNIQUEID="0" CHARGE_NAME="" CHARGE_STATUS="0" HASTIME="1" NOTEOPTION="TEMPLATESETTINGS" /><ass ASSNATRIBUID="70239" TEMPLUID="1001" ISDEFAULT="1" ASS_UID="63937" ASS_NAME="LBR300 Investigation" STARTDATE="09/10/2012" ENDDATE="11/27/2737" SDATE="2012-09-10T00:00:00" EDATE="2737-11-27T00:00:00" ETC="0" ASSCOMP="0" USERID="367" TASK_UID="40790" TASK_NAME="LBR300 Investigation" SHOWETC="0" TACCETYPE="1" TSTARTDATE="07/05/2005" TENDDATE="11/27/2737" PROJECT_UID="1248" PROJECT_NAME="LBR300 - Ladbrokes Support" ISETCEDIT="1" MGRUID="602" PMGRE="robert.sutherland@openbet.com" PMGRFN="Robert" PMGRLN="Sutherland-Smith" CLIENT_UID="93" CLIENT_NAME="LBR eGaming - Sportsbook" WORKTYPE_UID="10077" WORKTYPE_NAME="Support (u)" ISNONWORKINGTIME="0" PCOMPLETE="100" TASK_DESCRIPTION="" ISTPPSYNC="0" REQUESTCHANGEID="-1" HASPENDINGREQUEST="0" REQUESTSTARTDATE="01/01/1900" REQUESTENDDATE="01/01/1900" CHARGE_UNIQUEID="0" CHARGE_NAME="" CHARGE_STATUS="0" HASTIME="0" /><ass ASSNATRIBUID="102085" TEMPLUID="1001" ISDEFAULT="1" ASS_UID="94156" ASS_NAME="LBR300-OOH (u)" STARTDATE="03/11/2013" ENDDATE="11/27/2737" SDATE="2013-03-11T00:00:00" EDATE="2737-11-27T00:00:00" ETC="0" ASSCOMP="0" USERID="367" TASK_UID="15621" TASK_NAME="LBR300-OOH (u)" SHOWETC="0" TACCETYPE="1" TSTARTDATE="07/11/2010" TENDDATE="11/27/2737" PROJECT_UID="1248" PROJECT_NAME="LBR300 - Ladbrokes Support" ISETCEDIT="1" MGRUID="602" PMGRE="robert.sutherland@openbet.com" PMGRFN="Robert" PMGRLN="Sutherland-Smith" CLIENT_UID="93" CLIENT_NAME="LBR eGaming - Sportsbook" WORKTYPE_UID="10055" WORKTYPE_NAME="Development (u)" ISNONWORKINGTIME="0" PCOMPLETE="100" TASK_DESCRIPTION="" ISTPPSYNC="0" REQUESTCHANGEID="-1" HASPENDINGREQUEST="0" REQUESTSTARTDATE="01/01/1900" REQUESTENDDATE="01/01/1900" CHARGE_UNIQUEID="0" CHARGE_NAME="" CHARGE_STATUS="0" HASTIME="0" /><ass ASSNATRIBUID="80376" TEMPLUID="1001" ISDEFAULT="1" ASS_UID="72702" ASS_NAME="PKR300 Investigation" STARTDATE="11/01/2012" ENDDATE="11/27/2737" SDATE="2012-11-01T00:00:00" EDATE="2737-11-27T00:00:00" ETC="0" ASSCOMP="0" USERID="367" TASK_UID="40841" TASK_NAME="PKR300 Investigation" SHOWETC="0" TACCETYPE="1" TSTARTDATE="11/04/2010" TENDDATE="11/27/2737" PROJECT_UID="705" PROJECT_NAME="PKR300 - PKR Support" ISETCEDIT="1" MGRUID="602" PMGRE="robert.sutherland@openbet.com" PMGRFN="Robert" PMGRLN="Sutherland-Smith" CLIENT_UID="99" CLIENT_NAME="PKR" WORKTYPE_UID="10077" WORKTYPE_NAME="Support (u)" ISNONWORKINGTIME="0" PCOMPLETE="100" TASK_DESCRIPTION="" ISTPPSYNC="0" REQUESTCHANGEID="-1" HASPENDINGREQUEST="0" REQUESTSTARTDATE="01/01/1900" REQUESTENDDATE="01/01/1900" CHARGE_UNIQUEID="0" CHARGE_NAME="" CHARGE_STATUS="0" HASTIME="0" /><ass ASSNATRIBUID="85713" TEMPLUID="1001" ISDEFAULT="1" ASS_UID="77910" ASS_NAME="PPW300 Investigation" STARTDATE="12/03/2012" ENDDATE="11/27/2737" SDATE="2012-12-03T00:00:00" EDATE="2737-11-27T00:00:00" ETC="7200" ASSCOMP="0" USERID="367" TASK_UID="40873" TASK_NAME="PPW300 Investigation" SHOWETC="0" TACCETYPE="1" TSTARTDATE="07/04/2005" TENDDATE="11/27/2737" PROJECT_UID="1457" PROJECT_NAME="PPW300 - PaddyPower Support" ISETCEDIT="1" MGRUID="602" PMGRE="robert.sutherland@openbet.com" PMGRFN="Robert" PMGRLN="Sutherland-Smith" CLIENT_UID="101" CLIENT_NAME="Paddy Power" WORKTYPE_UID="10077" WORKTYPE_NAME="Support (u)" ISNONWORKINGTIME="0" PCOMPLETE="100" TASK_DESCRIPTION="" ISTPPSYNC="0" REQUESTCHANGEID="-1" HASPENDINGREQUEST="0" REQUESTSTARTDATE="01/01/1900" REQUESTENDDATE="01/01/1900" CHARGE_UNIQUEID="0" CHARGE_NAME="" CHARGE_STATUS="0" HASTIME="0" /><ass ASSNATRIBUID="80377" TEMPLUID="1001" ISDEFAULT="1" ASS_UID="72701" ASS_NAME="SPT300 Investigation" STARTDATE="11/01/2012" ENDDATE="11/27/2737" SDATE="2012-11-01T00:00:00" EDATE="2737-11-27T00:00:00" ETC="0" ASSCOMP="0" USERID="367" TASK_UID="40957" TASK_NAME="SPT300 Investigation" SHOWETC="0" TACCETYPE="1" TSTARTDATE="05/14/2008" TENDDATE="11/27/2737" PROJECT_UID="820" PROJECT_NAME="SPT300 - Sportech Support" ISETCEDIT="1" MGRUID="602" PMGRE="robert.sutherland@openbet.com" PMGRFN="Robert" PMGRLN="Sutherland-Smith" CLIENT_UID="112" CLIENT_NAME="Sportech" WORKTYPE_UID="10077" WORKTYPE_NAME="Support (u)" ISNONWORKINGTIME="0" PCOMPLETE="100" TASK_DESCRIPTION="" ISTPPSYNC="0" REQUESTCHANGEID="-1" HASPENDINGREQUEST="0" REQUESTSTARTDATE="01/01/1900" REQUESTENDDATE="01/01/1900" CHARGE_UNIQUEID="0" CHARGE_NAME="" CHARGE_STATUS="0" HASTIME="0" /><ass ASSNATRIBUID="27640" TEMPLUID="1001" ISDEFAULT="1" ASS_UID="22068" ASS_NAME="TRA - Enlightenment" STARTDATE="01/01/2010" ENDDATE="06/30/2021" SDATE="2010-01-01T00:00:00" EDATE="2021-06-30T00:00:00" ETC="2700" ASSCOMP="0" USERID="367" TASK_UID="15612" TASK_NAME="TRA - Enlightenment" SHOWETC="0" TACCETYPE="1" TSTARTDATE="01/01/2010" TENDDATE="11/27/2737" PROJECT_UID="4" PROJECT_NAME="Training" ISETCEDIT="1" MGRUID="0" PMGRE="" PMGRFN="" PMGRLN="" CLIENT_UID="22" CLIENT_NAME="Admin" WORKTYPE_UID="10066" WORKTYPE_NAME="Meeting (u)" ISNONWORKINGTIME="0" PCOMPLETE="100" TASK_DESCRIPTION="" ISTPPSYNC="0" REQUESTCHANGEID="-1" HASPENDINGREQUEST="0" REQUESTSTARTDATE="01/01/1900" REQUESTENDDATE="01/01/1900" CHARGE_UNIQUEID="0" CHARGE_NAME="" CHARGE_STATUS="0" HASTIME="0" /><ass ASSNATRIBUID="96361" TEMPLUID="1001" ISDEFAULT="1" ASS_UID="88500" ASS_NAME="TRA - External Technical Course" STARTDATE="02/04/2013" ENDDATE="11/27/2737" SDATE="2013-02-04T00:00:00" EDATE="2737-11-27T00:00:00" ETC="0" ASSCOMP="0" USERID="367" TASK_UID="340" TASK_NAME="TRA - External Technical Course" SHOWETC="0" TACCETYPE="1" TSTARTDATE="01/01/2010" TENDDATE="11/27/2737" PROJECT_UID="4" PROJECT_NAME="Training" ISETCEDIT="1" MGRUID="0" PMGRE="" PMGRFN="" PMGRLN="" CLIENT_UID="22" CLIENT_NAME="Admin" WORKTYPE_UID="10066" WORKTYPE_NAME="Meeting (u)" ISNONWORKINGTIME="0" PCOMPLETE="100" TASK_DESCRIPTION="" ISTPPSYNC="0" REQUESTCHANGEID="-1" HASPENDINGREQUEST="0" REQUESTSTARTDATE="01/01/1900" REQUESTENDDATE="01/01/1900" CHARGE_UNIQUEID="0" CHARGE_NAME="" CHARGE_STATUS="0" HASTIME="0" /><ass ASSNATRIBUID="27641" TEMPLUID="1001" ISDEFAULT="1" ASS_UID="22069" ASS_NAME="TRA - Internal Coaching - giving" STARTDATE="09/19/2011" ENDDATE="11/27/2737" SDATE="2011-09-19T00:00:00" EDATE="2737-11-27T00:00:00" ETC="0" ASSCOMP="0" USERID="367" TASK_UID="15615" TASK_NAME="TRA - Internal Coaching - giving" SHOWETC="0" TACCETYPE="1" TSTARTDATE="01/01/2010" TENDDATE="11/27/2737" PROJECT_UID="4" PROJECT_NAME="Training" ISETCEDIT="1" MGRUID="0" PMGRE="" PMGRFN="" PMGRLN="" CLIENT_UID="22" CLIENT_NAME="Admin" WORKTYPE_UID="10066" WORKTYPE_NAME="Meeting (u)" ISNONWORKINGTIME="0" PCOMPLETE="100" TASK_DESCRIPTION="" ISTPPSYNC="0" REQUESTCHANGEID="-1" HASPENDINGREQUEST="0" REQUESTSTARTDATE="01/01/1900" REQUESTENDDATE="01/01/1900" CHARGE_UNIQUEID="0" CHARGE_NAME="" CHARGE_STATUS="0" HASTIME="0" /><ass ASSNATRIBUID="27642" TEMPLUID="1001" ISDEFAULT="1" ASS_UID="22070" ASS_NAME="TRA - Internal Coaching - receiving" STARTDATE="09/19/2011" ENDDATE="11/27/2737" SDATE="2011-09-19T00:00:00" EDATE="2737-11-27T00:00:00" ETC="3600" ASSCOMP="0" USERID="367" TASK_UID="15616" TASK_NAME="TRA - Internal Coaching - receiving" SHOWETC="0" TACCETYPE="1" TSTARTDATE="01/01/2010" TENDDATE="11/27/2737" PROJECT_UID="4" PROJECT_NAME="Training" ISETCEDIT="1" MGRUID="0" PMGRE="" PMGRFN="" PMGRLN="" CLIENT_UID="22" CLIENT_NAME="Admin" WORKTYPE_UID="10066" WORKTYPE_NAME="Meeting (u)" ISNONWORKINGTIME="0" PCOMPLETE="100" TASK_DESCRIPTION="" ISTPPSYNC="0" REQUESTCHANGEID="-1" HASPENDINGREQUEST="0" REQUESTSTARTDATE="01/01/1900" REQUESTENDDATE="01/01/1900" CHARGE_UNIQUEID="0" CHARGE_NAME="" CHARGE_STATUS="0" HASTIME="0" /><ass ASSNATRIBUID="61329" TEMPLUID="1001" ISDEFAULT="1" ASS_UID="54904" ASS_NAME="WIL015d-Senior Developer" STARTDATE="07/09/2012" ENDDATE="11/27/2737" SDATE="2012-07-09T00:00:00" EDATE="2737-11-27T00:00:00" ETC="4500" ASSCOMP="0" USERID="367" TASK_UID="7727" TASK_NAME="WIL015d-Senior Developer" SHOWETC="0" TACCETYPE="1" TSTARTDATE="03/28/2011" TENDDATE="11/27/2737" PROJECT_UID="831" PROJECT_NAME="WIL015d Senior Developer" ISETCEDIT="1" MGRUID="547" PMGRE="George.Velimachitis@OpenBet.com " PMGRFN="George" PMGRLN="Velimachitis" CLIENT_UID="122" CLIENT_NAME="William Hill" WORKTYPE_UID="10013" WORKTYPE_NAME="Development" ISNONWORKINGTIME="0" PCOMPLETE="100" TASK_DESCRIPTION="" ISTPPSYNC="0" REQUESTCHANGEID="-1" HASPENDINGREQUEST="0" REQUESTSTARTDATE="01/01/1900" REQUESTENDDATE="01/01/1900" CHARGE_UNIQUEID="0" CHARGE_NAME="" CHARGE_STATUS="0" HASTIME="0" /><ass ASSNATRIBUID="10063" TEMPLUID="1001" ISDEFAULT="1" ASS_UID="10067" ASS_NAME="WIL017-Travel" STARTDATE="12/02/2008" ENDDATE="11/27/2737" SDATE="2008-12-02T00:00:00" EDATE="2737-11-27T00:00:00" ETC="0" ASSCOMP="0" USERID="367" TASK_UID="7789" TASK_NAME="WIL017-Travel" SHOWETC="0" TACCETYPE="1" TSTARTDATE="12/02/2008" TENDDATE="11/27/2737" PROJECT_UID="840" PROJECT_NAME="WIL017 Travel" ISETCEDIT="1" MGRUID="547" PMGRE="George.Velimachitis@OpenBet.com " PMGRFN="George" PMGRLN="Velimachitis" CLIENT_UID="122" CLIENT_NAME="William Hill" WORKTYPE_UID="10038" WORKTYPE_NAME="Travel" ISNONWORKINGTIME="0" PCOMPLETE="100" TASK_DESCRIPTION="" ISTPPSYNC="0" REQUESTCHANGEID="-1" HASPENDINGREQUEST="0" REQUESTSTARTDATE="01/01/1900" REQUESTENDDATE="01/01/1900" CHARGE_UNIQUEID="0" CHARGE_NAME="" CHARGE_STATUS="0" HASTIME="0" /><ass ASSNATRIBUID="96337" TEMPLUID="1001" ISDEFAULT="1" ASS_UID="88474" ASS_NAME="WIL1030-DB Deployment" STARTDATE="02/01/2013" ENDDATE="11/27/2737" SDATE="2013-02-01T00:00:00" EDATE="2737-11-27T00:00:00" ETC="-1" ASSCOMP="0" USERID="367" TASK_UID="51588" TASK_NAME="WIL1030-DB Deployment" SHOWETC="0" TACCETYPE="1" TSTARTDATE="07/01/2011" TENDDATE="11/27/2737" PROJECT_UID="6681" PROJECT_NAME="WIL1030 Release 30" ISETCEDIT="1" MGRUID="547" PMGRE="George.Velimachitis@OpenBet.com " PMGRFN="George" PMGRLN="Velimachitis" CLIENT_UID="122" CLIENT_NAME="William Hill" WORKTYPE_UID="10525" WORKTYPE_NAME="DB Deployment" ISNONWORKINGTIME="0" PCOMPLETE="0" TASK_DESCRIPTION="" ISTPPSYNC="0" REQUESTCHANGEID="-1" HASPENDINGREQUEST="0" REQUESTSTARTDATE="01/01/1900" REQUESTENDDATE="01/01/1900" CHARGE_UNIQUEID="0" CHARGE_NAME="" CHARGE_STATUS="0" HASTIME="0" /><ass ASSNATRIBUID="96338" TEMPLUID="1001" ISDEFAULT="1" ASS_UID="88475" ASS_NAME="WIL1030-Env Issues" STARTDATE="02/01/2013" ENDDATE="11/27/2737" SDATE="2013-02-01T00:00:00" EDATE="2737-11-27T00:00:00" ETC="-1" ASSCOMP="0" USERID="367" TASK_UID="51589" TASK_NAME="WIL1030-Env Issues" SHOWETC="0" TACCETYPE="1" TSTARTDATE="07/01/2011" TENDDATE="11/27/2737" PROJECT_UID="6681" PROJECT_NAME="WIL1030 Release 30" ISETCEDIT="1" MGRUID="547" PMGRE="George.Velimachitis@OpenBet.com " PMGRFN="George" PMGRLN="Velimachitis" CLIENT_UID="122" CLIENT_NAME="William Hill" WORKTYPE_UID="10522" WORKTYPE_NAME="Env Issues" ISNONWORKINGTIME="0" PCOMPLETE="0" TASK_DESCRIPTION="" ISTPPSYNC="0" REQUESTCHANGEID="-1" HASPENDINGREQUEST="0" REQUESTSTARTDATE="01/01/1900" REQUESTENDDATE="01/01/1900" CHARGE_UNIQUEID="0" CHARGE_NAME="" CHARGE_STATUS="0" HASTIME="0" /><ass ASSNATRIBUID="96339" TEMPLUID="1001" ISDEFAULT="1" ASS_UID="88476" ASS_NAME="WIL1030-Merge Issues: Development" STARTDATE="02/01/2013" ENDDATE="11/27/2737" SDATE="2013-02-01T00:00:00" EDATE="2737-11-27T00:00:00" ETC="-1" ASSCOMP="0" USERID="367" TASK_UID="51590" TASK_NAME="WIL1030-Merge Issues: Development" SHOWETC="0" TACCETYPE="1" TSTARTDATE="07/01/2011" TENDDATE="11/27/2737" PROJECT_UID="6681" PROJECT_NAME="WIL1030 Release 30" ISETCEDIT="1" MGRUID="547" PMGRE="George.Velimachitis@OpenBet.com " PMGRFN="George" PMGRLN="Velimachitis" CLIENT_UID="122" CLIENT_NAME="William Hill" WORKTYPE_UID="10532" WORKTYPE_NAME="Merge Issues: Development" ISNONWORKINGTIME="0" PCOMPLETE="0" TASK_DESCRIPTION="" ISTPPSYNC="0" REQUESTCHANGEID="-1" HASPENDINGREQUEST="0" REQUESTSTARTDATE="01/01/1900" REQUESTENDDATE="01/01/1900" CHARGE_UNIQUEID="0" CHARGE_NAME="" CHARGE_STATUS="0" HASTIME="0" /><ass ASSNATRIBUID="96340" TEMPLUID="1001" ISDEFAULT="1" ASS_UID="88477" ASS_NAME="WIL1030-Non-RT Related Bug Fixing" STARTDATE="02/01/2013" ENDDATE="11/27/2737" SDATE="2013-02-01T00:00:00" EDATE="2737-11-27T00:00:00" ETC="21600" ASSCOMP="0" USERID="367" TASK_UID="51591" TASK_NAME="WIL1030-Non-RT Related Bug Fixing" SHOWETC="0" TACCETYPE="1" TSTARTDATE="07/01/2011" TENDDATE="11/27/2737" PROJECT_UID="6681" PROJECT_NAME="WIL1030 Release 30" ISETCEDIT="1" MGRUID="547" PMGRE="George.Velimachitis@OpenBet.com " PMGRFN="George" PMGRLN="Velimachitis" CLIENT_UID="122" CLIENT_NAME="William Hill" WORKTYPE_UID="10533" WORKTYPE_NAME="Non-RT Related Bug Fixing" ISNONWORKINGTIME="0" PCOMPLETE="100" TASK_DESCRIPTION="" ISTPPSYNC="0" REQUESTCHANGEID="-1" HASPENDINGREQUEST="0" REQUESTSTARTDATE="01/01/1900" REQUESTENDDATE="01/01/1900" CHARGE_UNIQUEID="0" CHARGE_NAME="" CHARGE_STATUS="0" HASTIME="0" /><ass ASSNATRIBUID="96341" TEMPLUID="1001" ISDEFAULT="1" ASS_UID="88478" ASS_NAME="WIL1030-Release Engineer" STARTDATE="02/01/2013" ENDDATE="11/27/2737" SDATE="2013-02-01T00:00:00" EDATE="2737-11-27T00:00:00" ETC="3600" ASSCOMP="0" USERID="367" TASK_UID="51592" TASK_NAME="WIL1030-Release Engineer" SHOWETC="0" TACCETYPE="1" TSTARTDATE="07/01/2011" TENDDATE="11/27/2737" PROJECT_UID="6681" PROJECT_NAME="WIL1030 Release 30" ISETCEDIT="1" MGRUID="547" PMGRE="George.Velimachitis@OpenBet.com " PMGRFN="George" PMGRLN="Velimachitis" CLIENT_UID="122" CLIENT_NAME="William Hill" WORKTYPE_UID="10534" WORKTYPE_NAME="Release Engineer" ISNONWORKINGTIME="0" PCOMPLETE="100" TASK_DESCRIPTION="" ISTPPSYNC="0" REQUESTCHANGEID="-1" HASPENDINGREQUEST="0" REQUESTSTARTDATE="01/01/1900" REQUESTENDDATE="01/01/1900" CHARGE_UNIQUEID="0" CHARGE_NAME="" CHARGE_STATUS="0" HASTIME="0" /><ass ASSNATRIBUID="96342" TEMPLUID="1001" ISDEFAULT="1" ASS_UID="88479" ASS_NAME="WIL1030-Release Management" STARTDATE="02/01/2013" ENDDATE="11/27/2737" SDATE="2013-02-01T00:00:00" EDATE="2737-11-27T00:00:00" ETC="-1" ASSCOMP="0" USERID="367" TASK_UID="51593" TASK_NAME="WIL1030-Release Management" SHOWETC="0" TACCETYPE="1" TSTARTDATE="07/01/2011" TENDDATE="11/27/2737" PROJECT_UID="6681" PROJECT_NAME="WIL1030 Release 30" ISETCEDIT="1" MGRUID="547" PMGRE="George.Velimachitis@OpenBet.com " PMGRFN="George" PMGRLN="Velimachitis" CLIENT_UID="122" CLIENT_NAME="William Hill" WORKTYPE_UID="10535" WORKTYPE_NAME="Release Management" ISNONWORKINGTIME="0" PCOMPLETE="0" TASK_DESCRIPTION="" ISTPPSYNC="0" REQUESTCHANGEID="-1" HASPENDINGREQUEST="0" REQUESTSTARTDATE="01/01/1900" REQUESTENDDATE="01/01/1900" CHARGE_UNIQUEID="0" CHARGE_NAME="" CHARGE_STATUS="0" HASTIME="0" /><ass ASSNATRIBUID="96343" TEMPLUID="1001" ISDEFAULT="1" ASS_UID="88480" ASS_NAME="WIL1030-Release Manager" STARTDATE="02/01/2013" ENDDATE="11/27/2737" SDATE="2013-02-01T00:00:00" EDATE="2737-11-27T00:00:00" ETC="-1" ASSCOMP="0" USERID="367" TASK_UID="51594" TASK_NAME="WIL1030-Release Manager" SHOWETC="0" TACCETYPE="1" TSTARTDATE="07/01/2011" TENDDATE="11/27/2737" PROJECT_UID="6681" PROJECT_NAME="WIL1030 Release 30" ISETCEDIT="1" MGRUID="547" PMGRE="George.Velimachitis@OpenBet.com " PMGRFN="George" PMGRLN="Velimachitis" CLIENT_UID="122" CLIENT_NAME="William Hill" WORKTYPE_UID="10536" WORKTYPE_NAME="Release Manager" ISNONWORKINGTIME="0" PCOMPLETE="0" TASK_DESCRIPTION="" ISTPPSYNC="0" REQUESTCHANGEID="-1" HASPENDINGREQUEST="0" REQUESTSTARTDATE="01/01/1900" REQUESTENDDATE="01/01/1900" CHARGE_UNIQUEID="0" CHARGE_NAME="" CHARGE_STATUS="0" HASTIME="0" /><ass ASSNATRIBUID="96344" TEMPLUID="1001" ISDEFAULT="1" ASS_UID="88481" ASS_NAME="WIL1030-Smoke Testing" STARTDATE="02/01/2013" ENDDATE="11/27/2737" SDATE="2013-02-01T00:00:00" EDATE="2737-11-27T00:00:00" ETC="0" ASSCOMP="0" USERID="367" TASK_UID="51595" TASK_NAME="WIL1030-Smoke Testing" SHOWETC="0" TACCETYPE="1" TSTARTDATE="07/01/2011" TENDDATE="11/27/2737" PROJECT_UID="6681" PROJECT_NAME="WIL1030 Release 30" ISETCEDIT="1" MGRUID="547" PMGRE="George.Velimachitis@OpenBet.com " PMGRFN="George" PMGRLN="Velimachitis" CLIENT_UID="122" CLIENT_NAME="William Hill" WORKTYPE_UID="10537" WORKTYPE_NAME="Smoke Testing" ISNONWORKINGTIME="0" PCOMPLETE="100" TASK_DESCRIPTION="" ISTPPSYNC="0" REQUESTCHANGEID="-1" HASPENDINGREQUEST="0" REQUESTSTARTDATE="01/01/1900" REQUESTENDDATE="01/01/1900" CHARGE_UNIQUEID="0" CHARGE_NAME="" CHARGE_STATUS="0" HASTIME="0" /><ass ASSNATRIBUID="103214" TEMPLUID="1001" ISDEFAULT="1" ASS_UID="95279" ASS_NAME="WIL1030.1-Release Engineer" STARTDATE="03/18/2013" ENDDATE="11/27/2737" SDATE="2013-03-18T00:00:00" EDATE="2737-11-27T00:00:00" ETC="0" ASSCOMP="0" USERID="367" TASK_UID="55275" TASK_NAME="WIL1030.1-Release Engineer" SHOWETC="0" TACCETYPE="1" TSTARTDATE="07/01/2011" TENDDATE="11/27/2737" PROJECT_UID="7274" PROJECT_NAME="WIL1030.1 Release 30.1" ISETCEDIT="1" MGRUID="547" PMGRE="George.Velimachitis@OpenBet.com " PMGRFN="George" PMGRLN="Velimachitis" CLIENT_UID="122" CLIENT_NAME="William Hill" WORKTYPE_UID="10534" WORKTYPE_NAME="Release Engineer" ISNONWORKINGTIME="0" PCOMPLETE="100" TASK_DESCRIPTION="" ISTPPSYNC="0" REQUESTCHANGEID="-1" HASPENDINGREQUEST="0" REQUESTSTARTDATE="01/01/1900" REQUESTENDDATE="01/01/1900" CHARGE_UNIQUEID="0" CHARGE_NAME="" CHARGE_STATUS="0" HASTIME="1" NOTEOPTION="TEMPLATESETTINGS" /><ass ASSNATRIBUID="91278" TEMPLUID="1001" ISDEFAULT="1" ASS_UID="83383" ASS_NAME="WIL15000-Sample Commentary XML" STARTDATE="01/01/2013" ENDDATE="11/27/2737" SDATE="2013-01-01T00:00:00" EDATE="2737-11-27T00:00:00" ETC="-1" ASSCOMP="0" USERID="367" TASK_UID="50699" TASK_NAME="WIL15000-Sample Commentary XML" SHOWETC="0" TACCETYPE="1" TSTARTDATE="10/01/2012" TENDDATE="11/27/2737" PROJECT_UID="5645" PROJECT_NAME="WIL15000 [SBK054] SBK CIMB General" ISETCEDIT="1" MGRUID="547" PMGRE="George.Velimachitis@OpenBet.com " PMGRFN="George" PMGRLN="Velimachitis" CLIENT_UID="122" CLIENT_NAME="William Hill" WORKTYPE_UID="10018" WORKTYPE_NAME="General" ISNONWORKINGTIME="0" PCOMPLETE="0" TASK_DESCRIPTION="" ISTPPSYNC="0" REQUESTCHANGEID="-1" HASPENDINGREQUEST="0" REQUESTSTARTDATE="01/01/1900" REQUESTENDDATE="01/01/1900" CHARGE_UNIQUEID="0" CHARGE_NAME="" CHARGE_STATUS="0" HASTIME="0" /><ass ASSNATRIBUID="91279" TEMPLUID="1001" ISDEFAULT="1" ASS_UID="83384" ASS_NAME="WIL15000-3rd Party Liaison" STARTDATE="01/01/2013" ENDDATE="11/27/2737" SDATE="2013-01-01T00:00:00" EDATE="2737-11-27T00:00:00" ETC="-1" ASSCOMP="0" USERID="367" TASK_UID="46224" TASK_NAME="WIL15000-3rd Party Liaison" SHOWETC="0" TACCETYPE="1" TSTARTDATE="10/01/2012" TENDDATE="11/27/2737" PROJECT_UID="5645" PROJECT_NAME="WIL15000 [SBK054] SBK CIMB General" ISETCEDIT="1" MGRUID="547" PMGRE="George.Velimachitis@OpenBet.com " PMGRFN="George" PMGRLN="Velimachitis" CLIENT_UID="122" CLIENT_NAME="William Hill" WORKTYPE_UID="10521" WORKTYPE_NAME="3rd Party Liaison" ISNONWORKINGTIME="0" PCOMPLETE="0" TASK_DESCRIPTION="" ISTPPSYNC="0" REQUESTCHANGEID="-1" HASPENDINGREQUEST="0" REQUESTSTARTDATE="01/01/1900" REQUESTENDDATE="01/01/1900" CHARGE_UNIQUEID="0" CHARGE_NAME="" CHARGE_STATUS="0" HASTIME="0" /><ass ASSNATRIBUID="91280" TEMPLUID="1001" ISDEFAULT="1" ASS_UID="83385" ASS_NAME="WIL15000-Analysis" STARTDATE="01/01/2013" ENDDATE="11/27/2737" SDATE="2013-01-01T00:00:00" EDATE="2737-11-27T00:00:00" ETC="7200" ASSCOMP="0" USERID="367" TASK_UID="42506" TASK_NAME="WIL15000-Analysis" SHOWETC="0" TACCETYPE="1" TSTARTDATE="10/01/2012" TENDDATE="11/27/2737" PROJECT_UID="5645" PROJECT_NAME="WIL15000 [SBK054] SBK CIMB General" ISETCEDIT="1" MGRUID="547" PMGRE="George.Velimachitis@OpenBet.com " PMGRFN="George" PMGRLN="Velimachitis" CLIENT_UID="122" CLIENT_NAME="William Hill" WORKTYPE_UID="10002" WORKTYPE_NAME="Analysis" ISNONWORKINGTIME="0" PCOMPLETE="0" TASK_DESCRIPTION="" ISTPPSYNC="0" REQUESTCHANGEID="-1" HASPENDINGREQUEST="0" REQUESTSTARTDATE="01/01/1900" REQUESTENDDATE="01/01/1900" CHARGE_UNIQUEID="0" CHARGE_NAME="" CHARGE_STATUS="0" HASTIME="0" /><ass ASSNATRIBUID="91281" TEMPLUID="1001" ISDEFAULT="1" ASS_UID="83386" ASS_NAME="WIL15000-Analysis during dev and test phase " STARTDATE="01/01/2013" ENDDATE="11/27/2737" SDATE="2013-01-01T00:00:00" EDATE="2737-11-27T00:00:00" ETC="-1" ASSCOMP="0" USERID="367" TASK_UID="46225" TASK_NAME="WIL15000-Analysis during dev and test phase " SHOWETC="0" TACCETYPE="1" TSTARTDATE="10/01/2012" TENDDATE="11/27/2737" PROJECT_UID="5645" PROJECT_NAME="WIL15000 [SBK054] SBK CIMB General" ISETCEDIT="1" MGRUID="547" PMGRE="George.Velimachitis@OpenBet.com " PMGRFN="George" PMGRLN="Velimachitis" CLIENT_UID="122" CLIENT_NAME="William Hill" WORKTYPE_UID="10523" WORKTYPE_NAME="Analysis during dev and test phase " ISNONWORKINGTIME="0" PCOMPLETE="0" TASK_DESCRIPTION="" ISTPPSYNC="0" REQUESTCHANGEID="-1" HASPENDINGREQUEST="0" REQUESTSTARTDATE="01/01/1900" REQUESTENDDATE="01/01/1900" CHARGE_UNIQUEID="0" CHARGE_NAME="" CHARGE_STATUS="0" HASTIME="0" /><ass ASSNATRIBUID="91282" TEMPLUID="1001" ISDEFAULT="1" ASS_UID="83387" ASS_NAME="WIL15000-Analysis/Dev Co-ordination" STARTDATE="01/01/2013" ENDDATE="11/27/2737" SDATE="2013-01-01T00:00:00" EDATE="2737-11-27T00:00:00" ETC="-1" ASSCOMP="0" USERID="367" TASK_UID="46223" TASK_NAME="WIL15000-Analysis/Dev Co-ordination" SHOWETC="0" TACCETYPE="1" TSTARTDATE="10/01/2012" TENDDATE="11/27/2737" PROJECT_UID="5645" PROJECT_NAME="WIL15000 [SBK054] SBK CIMB General" ISETCEDIT="1" MGRUID="547" PMGRE="George.Velimachitis@OpenBet.com " PMGRFN="George" PMGRLN="Velimachitis" CLIENT_UID="122" CLIENT_NAME="William Hill" WORKTYPE_UID="10023" WORKTYPE_NAME="Management" ISNONWORKINGTIME="0" PCOMPLETE="0" TASK_DESCRIPTION="" ISTPPSYNC="0" REQUESTCHANGEID="-1" HASPENDINGREQUEST="0" REQUESTSTARTDATE="01/01/1900" REQUESTENDDATE="01/01/1900" CHARGE_UNIQUEID="0" CHARGE_NAME="" CHARGE_STATUS="0" HASTIME="0" /><ass ASSNATRIBUID="91283" TEMPLUID="1001" ISDEFAULT="1" ASS_UID="83388" ASS_NAME="WIL15000-Meetings and Calls" STARTDATE="01/01/2013" ENDDATE="11/27/2737" SDATE="2013-01-01T00:00:00" EDATE="2737-11-27T00:00:00" ETC="7200" ASSCOMP="0" USERID="367" TASK_UID="46226" TASK_NAME="WIL15000-Meetings and Calls" SHOWETC="0" TACCETYPE="1" TSTARTDATE="10/01/2012" TENDDATE="11/27/2737" PROJECT_UID="5645" PROJECT_NAME="WIL15000 [SBK054] SBK CIMB General" ISETCEDIT="1" MGRUID="547" PMGRE="George.Velimachitis@OpenBet.com " PMGRFN="George" PMGRLN="Velimachitis" CLIENT_UID="122" CLIENT_NAME="William Hill" WORKTYPE_UID="10526" WORKTYPE_NAME="Meetings and Calls" ISNONWORKINGTIME="0" PCOMPLETE="100" TASK_DESCRIPTION="" ISTPPSYNC="0" REQUESTCHANGEID="-1" HASPENDINGREQUEST="0" REQUESTSTARTDATE="01/01/1900" REQUESTENDDATE="01/01/1900" CHARGE_UNIQUEID="0" CHARGE_NAME="" CHARGE_STATUS="0" HASTIME="1" NOTEOPTION="TEMPLATESETTINGS" /><ass ASSNATRIBUID="91284" TEMPLUID="1001" ISDEFAULT="1" ASS_UID="83389" ASS_NAME="WIL15000-Tech Lead/Senior Developer" STARTDATE="01/01/2013" ENDDATE="11/27/2737" SDATE="2013-01-01T00:00:00" EDATE="2737-11-27T00:00:00" ETC="72000" ASSCOMP="0" USERID="367" TASK_UID="46227" TASK_NAME="WIL15000-Tech Lead/Senior Developer" SHOWETC="0" TACCETYPE="1" TSTARTDATE="10/01/2012" TENDDATE="11/27/2737" PROJECT_UID="5645" PROJECT_NAME="WIL15000 [SBK054] SBK CIMB General" ISETCEDIT="1" MGRUID="547" PMGRE="George.Velimachitis@OpenBet.com " PMGRFN="George" PMGRLN="Velimachitis" CLIENT_UID="122" CLIENT_NAME="William Hill" WORKTYPE_UID="10531" WORKTYPE_NAME="Tech Lead/Senior Developer" ISNONWORKINGTIME="0" PCOMPLETE="100" TASK_DESCRIPTION="" ISTPPSYNC="0" REQUESTCHANGEID="-1" HASPENDINGREQUEST="0" REQUESTSTARTDATE="01/01/1900" REQUESTENDDATE="01/01/1900" CHARGE_UNIQUEID="0" CHARGE_NAME="" CHARGE_STATUS="0" HASTIME="1" NOTEOPTION="TEMPLATESETTINGS" /><ass ASSNATRIBUID="98653" TEMPLUID="1001" ISDEFAULT="1" ASS_UID="90934" ASS_NAME="WIL15005-Analysis" STARTDATE="02/18/2013" ENDDATE="11/27/2737" SDATE="2013-02-18T00:00:00" EDATE="2737-11-27T00:00:00" ETC="7200" ASSCOMP="0" USERID="367" TASK_UID="47699" TASK_NAME="WIL15005-Analysis" SHOWETC="0" TACCETYPE="1" TSTARTDATE="10/15/2012" TENDDATE="11/27/2737" PROJECT_UID="6201" PROJECT_NAME="WIL15005 [SBK054] CIMB WIL-14346: CIMB Icon on the betslip" ISETCEDIT="1" MGRUID="547" PMGRE="George.Velimachitis@OpenBet.com " PMGRFN="George" PMGRLN="Velimachitis" CLIENT_UID="122" CLIENT_NAME="William Hill" WORKTYPE_UID="10002" WORKTYPE_NAME="Analysis" ISNONWORKINGTIME="0" PCOMPLETE="100" TASK_DESCRIPTION="" ISTPPSYNC="0" REQUESTCHANGEID="-1" HASPENDINGREQUEST="0" REQUESTSTARTDATE="01/01/1900" REQUESTENDDATE="01/01/1900" CHARGE_UNIQUEID="0" CHARGE_NAME="" CHARGE_STATUS="0" HASTIME="0" /><ass ASSNATRIBUID="98654" TEMPLUID="1001" ISDEFAULT="1" ASS_UID="90935" ASS_NAME="WIL15005-Analysis during dev and test phase " STARTDATE="02/18/2013" ENDDATE="11/27/2737" SDATE="2013-02-18T00:00:00" EDATE="2737-11-27T00:00:00" ETC="-1" ASSCOMP="0" USERID="367" TASK_UID="47700" TASK_NAME="WIL15005-Analysis during dev and test phase " SHOWETC="0" TACCETYPE="1" TSTARTDATE="10/15/2012" TENDDATE="11/27/2737" PROJECT_UID="6201" PROJECT_NAME="WIL15005 [SBK054] CIMB WIL-14346: CIMB Icon on the betslip" ISETCEDIT="1" MGRUID="547" PMGRE="George.Velimachitis@OpenBet.com " PMGRFN="George" PMGRLN="Velimachitis" CLIENT_UID="122" CLIENT_NAME="William Hill" WORKTYPE_UID="10523" WORKTYPE_NAME="Analysis during dev and test phase " ISNONWORKINGTIME="0" PCOMPLETE="0" TASK_DESCRIPTION="" ISTPPSYNC="0" REQUESTCHANGEID="-1" HASPENDINGREQUEST="0" REQUESTSTARTDATE="01/01/1900" REQUESTENDDATE="01/01/1900" CHARGE_UNIQUEID="0" CHARGE_NAME="" CHARGE_STATUS="0" HASTIME="0" /><ass ASSNATRIBUID="89369" TEMPLUID="1001" ISDEFAULT="1" ASS_UID="81828" ASS_NAME="WIL15009-Analysis during dev and test phase " STARTDATE="01/01/2013" ENDDATE="11/27/2737" SDATE="2013-01-01T00:00:00" EDATE="2737-11-27T00:00:00" ETC="-1" ASSCOMP="0" USERID="367" TASK_UID="47708" TASK_NAME="WIL15009-Analysis during dev and test phase " SHOWETC="0" TACCETYPE="1" TSTARTDATE="10/15/2012" TENDDATE="11/27/2737" PROJECT_UID="6205" PROJECT_NAME="WIL15009 [SBK054] CIMB WIL-14347: Estimated returns for price updates - complete solution" ISETCEDIT="1" MGRUID="547" PMGRE="George.Velimachitis@OpenBet.com " PMGRFN="George" PMGRLN="Velimachitis" CLIENT_UID="122" CLIENT_NAME="William Hill" WORKTYPE_UID="10523" WORKTYPE_NAME="Analysis during dev and test phase " ISNONWORKINGTIME="0" PCOMPLETE="0" TASK_DESCRIPTION="" ISTPPSYNC="0" REQUESTCHANGEID="-1" HASPENDINGREQUEST="0" REQUESTSTARTDATE="01/01/1900" REQUESTENDDATE="01/01/1900" CHARGE_UNIQUEID="0" CHARGE_NAME="" CHARGE_STATUS="0" HASTIME="0" /><ass ASSNATRIBUID="89370" TEMPLUID="1001" ISDEFAULT="1" ASS_UID="81829" ASS_NAME="WIL15009-Development" STARTDATE="01/01/2013" ENDDATE="11/27/2737" SDATE="2013-01-01T00:00:00" EDATE="2737-11-27T00:00:00" ETC="0" ASSCOMP="0" USERID="367" TASK_UID="47655" TASK_NAME="WIL15009-Development" SHOWETC="0" TACCETYPE="1" TSTARTDATE="10/15/2012" TENDDATE="11/27/2737" PROJECT_UID="6205" PROJECT_NAME="WIL15009 [SBK054] CIMB WIL-14347: Estimated returns for price updates - complete solution" ISETCEDIT="1" MGRUID="547" PMGRE="George.Velimachitis@OpenBet.com " PMGRFN="George" PMGRLN="Velimachitis" CLIENT_UID="122" CLIENT_NAME="William Hill" WORKTYPE_UID="10013" WORKTYPE_NAME="Development" ISNONWORKINGTIME="0" PCOMPLETE="100" TASK_DESCRIPTION="" ISTPPSYNC="0" REQUESTCHANGEID="-1" HASPENDINGREQUEST="0" REQUESTSTARTDATE="01/01/1900" REQUESTENDDATE="01/01/1900" CHARGE_UNIQUEID="0" CHARGE_NAME="" CHARGE_STATUS="0" HASTIME="0" /><ass ASSNATRIBUID="89371" TEMPLUID="1001" ISDEFAULT="1" ASS_UID="81830" ASS_NAME="WIL15009-System Test Support - OB issues" STARTDATE="01/01/2013" ENDDATE="11/27/2737" SDATE="2013-01-01T00:00:00" EDATE="2737-11-27T00:00:00" ETC="-1" ASSCOMP="0" USERID="367" TASK_UID="47662" TASK_NAME="WIL15009-System Test Support - OB issues" SHOWETC="0" TACCETYPE="1" TSTARTDATE="10/15/2012" TENDDATE="11/27/2737" PROJECT_UID="6205" PROJECT_NAME="WIL15009 [SBK054] CIMB WIL-14347: Estimated returns for price updates - complete solution" ISETCEDIT="1" MGRUID="547" PMGRE="George.Velimachitis@OpenBet.com " PMGRFN="George" PMGRLN="Velimachitis" CLIENT_UID="122" CLIENT_NAME="William Hill" WORKTYPE_UID="10530" WORKTYPE_NAME="System Test Support - OB issues" ISNONWORKINGTIME="0" PCOMPLETE="0" TASK_DESCRIPTION="" ISTPPSYNC="0" REQUESTCHANGEID="-1" HASPENDINGREQUEST="0" REQUESTSTARTDATE="01/01/1900" REQUESTENDDATE="01/01/1900" CHARGE_UNIQUEID="0" CHARGE_NAME="" CHARGE_STATUS="0" HASTIME="0" /><ass ASSNATRIBUID="89372" TEMPLUID="1001" ISDEFAULT="1" ASS_UID="81831" ASS_NAME="WIL15009-Tech Lead/Senior Developer" STARTDATE="01/01/2013" ENDDATE="11/27/2737" SDATE="2013-01-01T00:00:00" EDATE="2737-11-27T00:00:00" ETC="0" ASSCOMP="0" USERID="367" TASK_UID="47663" TASK_NAME="WIL15009-Tech Lead/Senior Developer" SHOWETC="0" TACCETYPE="1" TSTARTDATE="10/15/2012" TENDDATE="11/27/2737" PROJECT_UID="6205" PROJECT_NAME="WIL15009 [SBK054] CIMB WIL-14347: Estimated returns for price updates - complete solution" ISETCEDIT="1" MGRUID="547" PMGRE="George.Velimachitis@OpenBet.com " PMGRFN="George" PMGRLN="Velimachitis" CLIENT_UID="122" CLIENT_NAME="William Hill" WORKTYPE_UID="10531" WORKTYPE_NAME="Tech Lead/Senior Developer" ISNONWORKINGTIME="0" PCOMPLETE="100" TASK_DESCRIPTION="" ISTPPSYNC="0" REQUESTCHANGEID="-1" HASPENDINGREQUEST="0" REQUESTSTARTDATE="01/01/1900" REQUESTENDDATE="01/01/1900" CHARGE_UNIQUEID="0" CHARGE_NAME="" CHARGE_STATUS="0" HASTIME="0" /><ass ASSNATRIBUID="89368" TEMPLUID="1001" ISDEFAULT="1" ASS_UID="81827" ASS_NAME="WIL15014-Tech Lead/Senior Developer" STARTDATE="01/01/2013" ENDDATE="11/27/2737" SDATE="2013-01-01T00:00:00" EDATE="2737-11-27T00:00:00" ETC="10800" ASSCOMP="0" USERID="367" TASK_UID="48303" TASK_NAME="WIL15014-Tech Lead/Senior Developer" SHOWETC="0" TACCETYPE="1" TSTARTDATE="10/15/2012" TENDDATE="11/27/2737" PROJECT_UID="6301" PROJECT_NAME="WIL15014 [SBK054] CIMB WIL-12598 Singleton commentary Javascript" ISETCEDIT="1" MGRUID="547" PMGRE="George.Velimachitis@OpenBet.com " PMGRFN="George" PMGRLN="Velimachitis" CLIENT_UID="122" CLIENT_NAME="William Hill" WORKTYPE_UID="10531" WORKTYPE_NAME="Tech Lead/Senior Developer" ISNONWORKINGTIME="0" PCOMPLETE="100" TASK_DESCRIPTION="" ISTPPSYNC="0" REQUESTCHANGEID="-1" HASPENDINGREQUEST="0" REQUESTSTARTDATE="01/01/1900" REQUESTENDDATE="01/01/1900" CHARGE_UNIQUEID="0" CHARGE_NAME="" CHARGE_STATUS="0" HASTIME="1" NOTEOPTION="TEMPLATESETTINGS" /><ass ASSNATRIBUID="96345" TEMPLUID="1001" ISDEFAULT="1" ASS_UID="88487" ASS_NAME="WIL15022-Analysis" STARTDATE="02/01/2013" ENDDATE="11/27/2737" SDATE="2013-02-01T00:00:00" EDATE="2737-11-27T00:00:00" ETC="0" ASSCOMP="0" USERID="367" TASK_UID="53242" TASK_NAME="WIL15022-Analysis" SHOWETC="0" TACCETYPE="1" TSTARTDATE="12/17/2012" TENDDATE="11/27/2737" PROJECT_UID="6964" PROJECT_NAME="WIL15022 [SBK054] SBK WIL-15332 CIMB - Information box in the Open Bets tab" ISETCEDIT="1" MGRUID="547" PMGRE="George.Velimachitis@OpenBet.com " PMGRFN="George" PMGRLN="Velimachitis" CLIENT_UID="122" CLIENT_NAME="William Hill" WORKTYPE_UID="10002" WORKTYPE_NAME="Analysis" ISNONWORKINGTIME="0" PCOMPLETE="100" TASK_DESCRIPTION="" ISTPPSYNC="0" REQUESTCHANGEID="-1" HASPENDINGREQUEST="0" REQUESTSTARTDATE="01/01/1900" REQUESTENDDATE="01/01/1900" CHARGE_UNIQUEID="0" CHARGE_NAME="" CHARGE_STATUS="0" HASTIME="0" /><ass ASSNATRIBUID="96346" TEMPLUID="1001" ISDEFAULT="1" ASS_UID="88488" ASS_NAME="WIL15022-Tech Lead/Senior Developer" STARTDATE="02/01/2013" ENDDATE="11/27/2737" SDATE="2013-02-01T00:00:00" EDATE="2737-11-27T00:00:00" ETC="0" ASSCOMP="0" USERID="367" TASK_UID="53245" TASK_NAME="WIL15022-Tech Lead/Senior Developer" SHOWETC="0" TACCETYPE="1" TSTARTDATE="12/17/2012" TENDDATE="11/27/2737" PROJECT_UID="6964" PROJECT_NAME="WIL15022 [SBK054] SBK WIL-15332 CIMB - Information box in the Open Bets tab" ISETCEDIT="1" MGRUID="547" PMGRE="George.Velimachitis@OpenBet.com " PMGRFN="George" PMGRLN="Velimachitis" CLIENT_UID="122" CLIENT_NAME="William Hill" WORKTYPE_UID="10531" WORKTYPE_NAME="Tech Lead/Senior Developer" ISNONWORKINGTIME="0" PCOMPLETE="100" TASK_DESCRIPTION="" ISTPPSYNC="0" REQUESTCHANGEID="-1" HASPENDINGREQUEST="0" REQUESTSTARTDATE="01/01/1900" REQUESTENDDATE="01/01/1900" CHARGE_UNIQUEID="0" CHARGE_NAME="" CHARGE_STATUS="0" HASTIME="0" /><ass ASSNATRIBUID="96537" TEMPLUID="1001" ISDEFAULT="1" ASS_UID="88666" ASS_NAME="WIL15025-Code Review/Code Changes/Walkthrough" STARTDATE="02/04/2013" ENDDATE="11/27/2737" SDATE="2013-02-04T00:00:00" EDATE="2737-11-27T00:00:00" ETC="0" ASSCOMP="0" USERID="367" TASK_UID="53952" TASK_NAME="WIL15025-Code Review/Code Changes/Walkthrough" SHOWETC="0" TACCETYPE="1" TSTARTDATE="12/17/2012" TENDDATE="11/27/2737" PROJECT_UID="7019" PROJECT_NAME="WIL15025 [SBK054] SBK WIL-15237 PUSH in the betslip - .it" ISETCEDIT="1" MGRUID="547" PMGRE="George.Velimachitis@OpenBet.com " PMGRFN="George" PMGRLN="Velimachitis" CLIENT_UID="122" CLIENT_NAME="William Hill" WORKTYPE_UID="10524" WORKTYPE_NAME="Code Review/Code Changes/Walkthrough" ISNONWORKINGTIME="0" PCOMPLETE="100" TASK_DESCRIPTION="" ISTPPSYNC="0" REQUESTCHANGEID="-1" HASPENDINGREQUEST="0" REQUESTSTARTDATE="01/01/1900" REQUESTENDDATE="01/01/1900" CHARGE_UNIQUEID="0" CHARGE_NAME="" CHARGE_STATUS="0" HASTIME="0" /><ass ASSNATRIBUID="96538" TEMPLUID="1001" ISDEFAULT="1" ASS_UID="88667" ASS_NAME="WIL15025-Tech Lead/Senior Developer" STARTDATE="02/04/2013" ENDDATE="11/27/2737" SDATE="2013-02-04T00:00:00" EDATE="2737-11-27T00:00:00" ETC="3600" ASSCOMP="0" USERID="367" TASK_UID="53607" TASK_NAME="WIL15025-Tech Lead/Senior Developer" SHOWETC="0" TACCETYPE="1" TSTARTDATE="12/17/2012" TENDDATE="11/27/2737" PROJECT_UID="7019" PROJECT_NAME="WIL15025 [SBK054] SBK WIL-15237 PUSH in the betslip - .it" ISETCEDIT="1" MGRUID="547" PMGRE="George.Velimachitis@OpenBet.com " PMGRFN="George" PMGRLN="Velimachitis" CLIENT_UID="122" CLIENT_NAME="William Hill" WORKTYPE_UID="10531" WORKTYPE_NAME="Tech Lead/Senior Developer" ISNONWORKINGTIME="0" PCOMPLETE="100" TASK_DESCRIPTION="" ISTPPSYNC="0" REQUESTCHANGEID="-1" HASPENDINGREQUEST="0" REQUESTSTARTDATE="01/01/1900" REQUESTENDDATE="01/01/1900" CHARGE_UNIQUEID="0" CHARGE_NAME="" CHARGE_STATUS="0" HASTIME="0" /><ass ASSNATRIBUID="96347" TEMPLUID="1001" ISDEFAULT="1" ASS_UID="88482" ASS_NAME="WIL15027-Analysis" STARTDATE="02/01/2013" ENDDATE="11/27/2737" SDATE="2013-02-01T00:00:00" EDATE="2737-11-27T00:00:00" ETC="0" ASSCOMP="0" USERID="367" TASK_UID="54515" TASK_NAME="WIL15027-Analysis" SHOWETC="0" TACCETYPE="1" TSTARTDATE="12/17/2012" TENDDATE="11/27/2737" PROJECT_UID="7153" PROJECT_NAME="WIL15027 [SBK054] SBK WIL-15400 Replace the cash out value with the word &amp;amp;quot;Unavailable&amp;amp;quot; when betting is suspended" ISETCEDIT="1" MGRUID="547" PMGRE="George.Velimachitis@OpenBet.com " PMGRFN="George" PMGRLN="Velimachitis" CLIENT_UID="122" CLIENT_NAME="William Hill" WORKTYPE_UID="10002" WORKTYPE_NAME="Analysis" ISNONWORKINGTIME="0" PCOMPLETE="100" TASK_DESCRIPTION="" ISTPPSYNC="0" REQUESTCHANGEID="-1" HASPENDINGREQUEST="0" REQUESTSTARTDATE="01/01/1900" REQUESTENDDATE="01/01/1900" CHARGE_UNIQUEID="0" CHARGE_NAME="" CHARGE_STATUS="0" HASTIME="0" /><ass ASSNATRIBUID="96348" TEMPLUID="1001" ISDEFAULT="1" ASS_UID="88483" ASS_NAME="WIL15027-Analysis during dev and test phase" STARTDATE="02/01/2013" ENDDATE="11/27/2737" SDATE="2013-02-01T00:00:00" EDATE="2737-11-27T00:00:00" ETC="-1" ASSCOMP="0" USERID="367" TASK_UID="54516" TASK_NAME="WIL15027-Analysis during dev and test phase" SHOWETC="0" TACCETYPE="1" TSTARTDATE="12/17/2012" TENDDATE="11/27/2737" PROJECT_UID="7153" PROJECT_NAME="WIL15027 [SBK054] SBK WIL-15400 Replace the cash out value with the word &amp;amp;quot;Unavailable&amp;amp;quot; when betting is suspended" ISETCEDIT="1" MGRUID="547" PMGRE="George.Velimachitis@OpenBet.com " PMGRFN="George" PMGRLN="Velimachitis" CLIENT_UID="122" CLIENT_NAME="William Hill" WORKTYPE_UID="10523" WORKTYPE_NAME="Analysis during dev and test phase " ISNONWORKINGTIME="0" PCOMPLETE="0" TASK_DESCRIPTION="" ISTPPSYNC="0" REQUESTCHANGEID="-1" HASPENDINGREQUEST="0" REQUESTSTARTDATE="01/01/1900" REQUESTENDDATE="01/01/1900" CHARGE_UNIQUEID="0" CHARGE_NAME="" CHARGE_STATUS="0" HASTIME="0" /><ass ASSNATRIBUID="96349" TEMPLUID="1001" ISDEFAULT="1" ASS_UID="88484" ASS_NAME="WIL15027-Code Review/Code Changes/Walkthrough" STARTDATE="02/01/2013" ENDDATE="11/27/2737" SDATE="2013-02-01T00:00:00" EDATE="2737-11-27T00:00:00" ETC="7200" ASSCOMP="0" USERID="367" TASK_UID="54518" TASK_NAME="WIL15027-Code Review/Code Changes/Walkthrough" SHOWETC="0" TACCETYPE="1" TSTARTDATE="12/17/2012" TENDDATE="11/27/2737" PROJECT_UID="7153" PROJECT_NAME="WIL15027 [SBK054] SBK WIL-15400 Replace the cash out value with the word &amp;amp;quot;Unavailable&amp;amp;quot; when betting is suspended" ISETCEDIT="1" MGRUID="547" PMGRE="George.Velimachitis@OpenBet.com " PMGRFN="George" PMGRLN="Velimachitis" CLIENT_UID="122" CLIENT_NAME="William Hill" WORKTYPE_UID="10524" WORKTYPE_NAME="Code Review/Code Changes/Walkthrough" ISNONWORKINGTIME="0" PCOMPLETE="100" TASK_DESCRIPTION="" ISTPPSYNC="0" REQUESTCHANGEID="-1" HASPENDINGREQUEST="0" REQUESTSTARTDATE="01/01/1900" REQUESTENDDATE="01/01/1900" CHARGE_UNIQUEID="0" CHARGE_NAME="" CHARGE_STATUS="0" HASTIME="0" /><ass ASSNATRIBUID="96350" TEMPLUID="1001" ISDEFAULT="1" ASS_UID="88485" ASS_NAME="WIL15027-Development" STARTDATE="02/01/2013" ENDDATE="11/27/2737" SDATE="2013-02-01T00:00:00" EDATE="2737-11-27T00:00:00" ETC="-1" ASSCOMP="0" USERID="367" TASK_UID="54519" TASK_NAME="WIL15027-Development" SHOWETC="0" TACCETYPE="1" TSTARTDATE="12/17/2012" TENDDATE="11/27/2737" PROJECT_UID="7153" PROJECT_NAME="WIL15027 [SBK054] SBK WIL-15400 Replace the cash out value with the word &amp;amp;quot;Unavailable&amp;amp;quot; when betting is suspended" ISETCEDIT="1" MGRUID="547" PMGRE="George.Velimachitis@OpenBet.com " PMGRFN="George" PMGRLN="Velimachitis" CLIENT_UID="122" CLIENT_NAME="William Hill" WORKTYPE_UID="10013" WORKTYPE_NAME="Development" ISNONWORKINGTIME="0" PCOMPLETE="0" TASK_DESCRIPTION="" ISTPPSYNC="0" REQUESTCHANGEID="-1" HASPENDINGREQUEST="0" REQUESTSTARTDATE="01/01/1900" REQUESTENDDATE="01/01/1900" CHARGE_UNIQUEID="0" CHARGE_NAME="" CHARGE_STATUS="0" HASTIME="0" /><ass ASSNATRIBUID="96351" TEMPLUID="1001" ISDEFAULT="1" ASS_UID="88486" ASS_NAME="WIL15027-Tech Lead/Senior Developer" STARTDATE="02/01/2013" ENDDATE="11/27/2737" SDATE="2013-02-01T00:00:00" EDATE="2737-11-27T00:00:00" ETC="1800" ASSCOMP="0" USERID="367" TASK_UID="54526" TASK_NAME="WIL15027-Tech Lead/Senior Developer" SHOWETC="0" TACCETYPE="1" TSTARTDATE="12/17/2012" TENDDATE="11/27/2737" PROJECT_UID="7153" PROJECT_NAME="WIL15027 [SBK054] SBK WIL-15400 Replace the cash out value with the word &amp;amp;quot;Unavailable&amp;amp;quot; when betting is suspended" ISETCEDIT="1" MGRUID="547" PMGRE="George.Velimachitis@OpenBet.com " PMGRFN="George" PMGRLN="Velimachitis" CLIENT_UID="122" CLIENT_NAME="William Hill" WORKTYPE_UID="10531" WORKTYPE_NAME="Tech Lead/Senior Developer" ISNONWORKINGTIME="0" PCOMPLETE="100" TASK_DESCRIPTION="" ISTPPSYNC="0" REQUESTCHANGEID="-1" HASPENDINGREQUEST="0" REQUESTSTARTDATE="01/01/1900" REQUESTENDDATE="01/01/1900" CHARGE_UNIQUEID="0" CHARGE_NAME="" CHARGE_STATUS="0" HASTIME="0" /><ass ASSNATRIBUID="97463" TEMPLUID="1001" ISDEFAULT="1" ASS_UID="89513" ASS_NAME="WIL15030-Analysis" STARTDATE="02/11/2013" ENDDATE="11/27/2737" SDATE="2013-02-11T00:00:00" EDATE="2737-11-27T00:00:00" ETC="0" ASSCOMP="0" USERID="367" TASK_UID="55165" TASK_NAME="WIL15030-Analysis" SHOWETC="0" TACCETYPE="1" TSTARTDATE="12/17/2012" TENDDATE="11/27/2737" PROJECT_UID="7251" PROJECT_NAME="WIL15030 [SBK054] SBK WIL-15515 Adding granularity to CIMB database configs" ISETCEDIT="1" MGRUID="547" PMGRE="George.Velimachitis@OpenBet.com " PMGRFN="George" PMGRLN="Velimachitis" CLIENT_UID="122" CLIENT_NAME="William Hill" WORKTYPE_UID="10002" WORKTYPE_NAME="Analysis" ISNONWORKINGTIME="0" PCOMPLETE="100" TASK_DESCRIPTION="" ISTPPSYNC="0" REQUESTCHANGEID="-1" HASPENDINGREQUEST="0" REQUESTSTARTDATE="01/01/1900" REQUESTENDDATE="01/01/1900" CHARGE_UNIQUEID="0" CHARGE_NAME="" CHARGE_STATUS="0" HASTIME="0" /><ass ASSNATRIBUID="97464" TEMPLUID="1001" ISDEFAULT="1" ASS_UID="89514" ASS_NAME="WIL15030-Code Review/Code Changes/Walkthrough" STARTDATE="02/11/2013" ENDDATE="11/27/2737" SDATE="2013-02-11T00:00:00" EDATE="2737-11-27T00:00:00" ETC="-1" ASSCOMP="0" USERID="367" TASK_UID="55168" TASK_NAME="WIL15030-Code Review/Code Changes/Walkthrough" SHOWETC="0" TACCETYPE="1" TSTARTDATE="12/17/2012" TENDDATE="11/27/2737" PROJECT_UID="7251" PROJECT_NAME="WIL15030 [SBK054] SBK WIL-15515 Adding granularity to CIMB database configs" ISETCEDIT="1" MGRUID="547" PMGRE="George.Velimachitis@OpenBet.com " PMGRFN="George" PMGRLN="Velimachitis" CLIENT_UID="122" CLIENT_NAME="William Hill" WORKTYPE_UID="10524" WORKTYPE_NAME="Code Review/Code Changes/Walkthrough" ISNONWORKINGTIME="0" PCOMPLETE="0" TASK_DESCRIPTION="" ISTPPSYNC="0" REQUESTCHANGEID="-1" HASPENDINGREQUEST="0" REQUESTSTARTDATE="01/01/1900" REQUESTENDDATE="01/01/1900" CHARGE_UNIQUEID="0" CHARGE_NAME="" CHARGE_STATUS="0" HASTIME="0" /><ass ASSNATRIBUID="97465" TEMPLUID="1001" ISDEFAULT="1" ASS_UID="89515" ASS_NAME="WIL15030-Tech Lead/Senior Developer" STARTDATE="02/11/2013" ENDDATE="11/27/2737" SDATE="2013-02-11T00:00:00" EDATE="2737-11-27T00:00:00" ETC="0" ASSCOMP="0" USERID="367" TASK_UID="55176" TASK_NAME="WIL15030-Tech Lead/Senior Developer" SHOWETC="0" TACCETYPE="1" TSTARTDATE="12/17/2012" TENDDATE="11/27/2737" PROJECT_UID="7251" PROJECT_NAME="WIL15030 [SBK054] SBK WIL-15515 Adding granularity to CIMB database configs" ISETCEDIT="1" MGRUID="547" PMGRE="George.Velimachitis@OpenBet.com " PMGRFN="George" PMGRLN="Velimachitis" CLIENT_UID="122" CLIENT_NAME="William Hill" WORKTYPE_UID="10531" WORKTYPE_NAME="Tech Lead/Senior Developer" ISNONWORKINGTIME="0" PCOMPLETE="100" TASK_DESCRIPTION="" ISTPPSYNC="0" REQUESTCHANGEID="-1" HASPENDINGREQUEST="0" REQUESTSTARTDATE="01/01/1900" REQUESTENDDATE="01/01/1900" CHARGE_UNIQUEID="0" CHARGE_NAME="" CHARGE_STATUS="0" HASTIME="0" /><ass ASSNATRIBUID="96355" TEMPLUID="1001" ISDEFAULT="1" ASS_UID="88490" ASS_NAME="WIL16002-Analysis" STARTDATE="02/01/2013" ENDDATE="11/27/2737" SDATE="2013-02-01T00:00:00" EDATE="2737-11-27T00:00:00" ETC="-1" ASSCOMP="0" USERID="367" TASK_UID="54536" TASK_NAME="WIL16002-Analysis" SHOWETC="0" TACCETYPE="1" TSTARTDATE="11/23/2012" TENDDATE="11/27/2737" PROJECT_UID="7154" PROJECT_NAME="WIL16002 [C11999] SBK WIL-15396 Script to be written to configure the results scoreboard ON/OFF by locale" ISETCEDIT="1" MGRUID="547" PMGRE="George.Velimachitis@OpenBet.com " PMGRFN="George" PMGRLN="Velimachitis" CLIENT_UID="122" CLIENT_NAME="William Hill" WORKTYPE_UID="10002" WORKTYPE_NAME="Analysis" ISNONWORKINGTIME="0" PCOMPLETE="0" TASK_DESCRIPTION="" ISTPPSYNC="0" REQUESTCHANGEID="-1" HASPENDINGREQUEST="0" REQUESTSTARTDATE="01/01/1900" REQUESTENDDATE="01/01/1900" CHARGE_UNIQUEID="0" CHARGE_NAME="" CHARGE_STATUS="0" HASTIME="0" /><ass ASSNATRIBUID="96356" TEMPLUID="1001" ISDEFAULT="1" ASS_UID="88491" ASS_NAME="WIL16002-Code Review/Code Changes/Walkthrough" STARTDATE="02/01/2013" ENDDATE="11/27/2737" SDATE="2013-02-01T00:00:00" EDATE="2737-11-27T00:00:00" ETC="-1" ASSCOMP="0" USERID="367" TASK_UID="54538" TASK_NAME="WIL16002-Code Review/Code Changes/Walkthrough" SHOWETC="0" TACCETYPE="1" TSTARTDATE="11/23/2012" TENDDATE="11/27/2737" PROJECT_UID="7154" PROJECT_NAME="WIL16002 [C11999] SBK WIL-15396 Script to be written to configure the results scoreboard ON/OFF by locale" ISETCEDIT="1" MGRUID="547" PMGRE="George.Velimachitis@OpenBet.com " PMGRFN="George" PMGRLN="Velimachitis" CLIENT_UID="122" CLIENT_NAME="William Hill" WORKTYPE_UID="10524" WORKTYPE_NAME="Code Review/Code Changes/Walkthrough" ISNONWORKINGTIME="0" PCOMPLETE="0" TASK_DESCRIPTION="" ISTPPSYNC="0" REQUESTCHANGEID="-1" HASPENDINGREQUEST="0" REQUESTSTARTDATE="01/01/1900" REQUESTENDDATE="01/01/1900" CHARGE_UNIQUEID="0" CHARGE_NAME="" CHARGE_STATUS="0" HASTIME="0" /><ass ASSNATRIBUID="96357" TEMPLUID="1001" ISDEFAULT="1" ASS_UID="88492" ASS_NAME="WIL16002-Tech Lead/Senior Developer" STARTDATE="02/01/2013" ENDDATE="11/27/2737" SDATE="2013-02-01T00:00:00" EDATE="2737-11-27T00:00:00" ETC="0" ASSCOMP="0" USERID="367" TASK_UID="54546" TASK_NAME="WIL16002-Tech Lead/Senior Developer" SHOWETC="0" TACCETYPE="1" TSTARTDATE="11/23/2012" TENDDATE="11/27/2737" PROJECT_UID="7154" PROJECT_NAME="WIL16002 [C11999] SBK WIL-15396 Script to be written to configure the results scoreboard ON/OFF by locale" ISETCEDIT="1" MGRUID="547" PMGRE="George.Velimachitis@OpenBet.com " PMGRFN="George" PMGRLN="Velimachitis" CLIENT_UID="122" CLIENT_NAME="William Hill" WORKTYPE_UID="10531" WORKTYPE_NAME="Tech Lead/Senior Developer" ISNONWORKINGTIME="0" PCOMPLETE="100" TASK_DESCRIPTION="" ISTPPSYNC="0" REQUESTCHANGEID="-1" HASPENDINGREQUEST="0" REQUESTSTARTDATE="01/01/1900" REQUESTENDDATE="01/01/1900" CHARGE_UNIQUEID="0" CHARGE_NAME="" CHARGE_STATUS="0" HASTIME="0" /><ass ASSNATRIBUID="78078" TEMPLUID="1001" ISDEFAULT="1" ASS_UID="70314" ASS_NAME="WIL300 Investigation" STARTDATE="10/15/2012" ENDDATE="11/27/2737" SDATE="2012-10-15T00:00:00" EDATE="2737-11-27T00:00:00" ETC="2700" ASSCOMP="0" USERID="367" TASK_UID="41025" TASK_NAME="WIL300 Investigation" SHOWETC="0" TACCETYPE="1" TSTARTDATE="12/02/2008" TENDDATE="11/27/2737" PROJECT_UID="912" PROJECT_NAME="WIL300 - WillHill Support" ISETCEDIT="1" MGRUID="602" PMGRE="robert.sutherland@openbet.com" PMGRFN="Robert" PMGRLN="Sutherland-Smith" CLIENT_UID="122" CLIENT_NAME="William Hill" WORKTYPE_UID="10077" WORKTYPE_NAME="Support (u)" ISNONWORKINGTIME="0" PCOMPLETE="100" TASK_DESCRIPTION="" ISTPPSYNC="0" REQUESTCHANGEID="-1" HASPENDINGREQUEST="0" REQUESTSTARTDATE="01/01/1900" REQUESTENDDATE="01/01/1900" CHARGE_UNIQUEID="0" CHARGE_NAME="" CHARGE_STATUS="0" HASTIME="1" NOTEOPTION="TEMPLATESETTINGS" /><ass ASSNATRIBUID="78079" TEMPLUID="1001" ISDEFAULT="1" ASS_UID="70315" ASS_NAME="WIL300 Live Delivery" STARTDATE="10/15/2012" ENDDATE="11/27/2737" SDATE="2012-10-15T00:00:00" EDATE="2737-11-27T00:00:00" ETC="0" ASSCOMP="0" USERID="367" TASK_UID="41027" TASK_NAME="WIL300 Live Delivery" SHOWETC="0" TACCETYPE="1" TSTARTDATE="12/02/2008" TENDDATE="11/27/2737" PROJECT_UID="912" PROJECT_NAME="WIL300 - WillHill Support" ISETCEDIT="1" MGRUID="602" PMGRE="robert.sutherland@openbet.com" PMGRFN="Robert" PMGRLN="Sutherland-